id,name,icon,rarity,description,effect,skill_points,type,parent_id,required_sp,category,base_duration
best_day_ever,Best Day Ever,unique_skill.png,Unique,"If well-positioned late-race on the final corner or later, increase velocity. If there's a large distance left to the finish, also increase acceleration very slightly with perfect form.",Increase target speed (0.35),,normal,,,unique,5s
one_true_color,One True Color,unique_skill.png,Unique,"If positioned toward the front with 350m or less remaining and there is another Umamusume close behind, the determination to stay ahead makes it easier to break out of the pack.",Increase target speed (0.25),,normal,,,unique,5s
now_we_re_cruisin,Now We're Cruisin'!,unique_skill.png,Unique,"When competing for the lead if positioned in the midpack or further for the first half of the race, show off some Edo spirit and greatly increase velocity.",Increase target speed (0.45),,normal,,,unique,5s
victory_belongs_to_mestrelitzia,Victory Belongs to Me—Strelitzia! ☆,unique_skill.png,Unique,"If positioned toward the back and racing calmly until the start of the final corner, when there are 300m remaining, cast a magic spell to increase velocity continuously.",Increase target speed (0.35),,normal,,,unique,6s
joyful_voyage,Joyful Voyage!,unique_skill.png,Unique,"If positioned toward the front with 200m remaining, increase velocity. Then, if also positioned near the leading Umamusume, gather strength to move slightly forward.",Increase target speed (0.35),,normal,,,unique,5s
wherever_this_wonder_leads,Wherever This Wonder Leads,unique_skill.png,Unique,"If positioned midpack on a downhill just before late-race and there's a large distance left to the finish, enjoy the race to the fullest, increasing velocity.",Increase target speed (0.35),,normal,,,unique,5s
trigger_beat,trigger:BEAT,unique_skill.png,Unique,"When near the inner rail midpack on the final corner or later, calculate the path to victory, increasing velocity and ability to navigate smoothly on the final straight.",Increase target speed (0.35),,normal,,,unique,5s
dreams_donned_with_pride,Dreams Donned with Pride!,unique_skill.png,Unique,"If the user activates another skill on the final corner late-race, take the crowd's cheers to heart and moderately increase velocity. If racing at Nakayama Racecourse, greatly increase velocity instead.",Increase target speed (0.45),,normal,,,unique,5s
defeatist,Defeatist,negative_accel.png,Negative,Moderately increase urge to give up when positioned around the very back on the final straight.,Decrease current speed (-0.2),100,normal,,,negative,3s
reckless,Reckless,negative_accel.png,Negative,Moderately increase carelessness when in the lead with around 200m remaining.,Decrease current speed (-0.2),100,normal,,,negative,3s
blatant_fear,Blatant Fear,super_negative_accel.png,Upgraded,Greatly decrease velocity on a corner in the second half of the race due to Trainer's obvious anxiety.,Decrease current speed (-0.3),,normal,,,negative,5s
corner_acceleration,Corner Acceleration ○,acceleration_skill.png,Normal,Slightly increase acceleration on a corner with masterful turning.,Increase acceleration (0.2),180,normal,,,buff,3s
corner_connoisseur,Corner Connoisseur,super_acceleration_skill.png,Upgraded,Increase acceleration on a corner with masterful turning.,Increase acceleration (0.4),,upgrade,corner_acceleration,180,buff,3s
straightaway_acceleration,Straightaway Acceleration,acceleration_skill.png,Normal,Slightly increase acceleration on a straight.,Increase acceleration (0.2),170,normal,,,buff,3s
rushing_gale,Rushing Gale!,super_acceleration_skill.png,Upgraded,Increase acceleration on a straight.,Increase acceleration (0.4),,upgrade,straightaway_acceleration,170,buff,3s
nimble_navigator,Nimble Navigator,acceleration_skill.png,Normal,Slightly increase maneuverability when the way ahead is blocked in the last spurt.,Increase acceleration (0.2),150,normal,,,buff,3s
no_stopping_me,No Stopping Me!,super_acceleration_skill.png,Upgraded,Increase maneuverability when the way ahead is blocked in the last spurt.,Increase acceleration (0.4),,upgrade,nimble_navigator,150,buff,3s
early_lead,Early Lead,acceleration_skill.png,Normal,Slightly increase ability to go to the front early-race. (Front Runner),Increase acceleration (0.2),120,normal,,,buff,1.2s
taking_the_lead,Taking the Lead,super_acceleration_skill.png,Upgraded,Increase ability to go to the front early-race. (Front Runner),Increase acceleration (0.4),,upgrade,early_lead,120,buff,1.2s
final_push,Final Push,acceleration_skill.png,Normal,Slightly increase ability to keep the lead on the final corner. (Front Runner),Increase acceleration (0.2),180,normal,,,buff,3s
unrestrained,Unrestrained,super_acceleration_skill.png,Upgraded,Increase ability to keep the lead on the final corner. (Front Runner),Increase acceleration (0.4),,upgrade,final_push,180,buff,3s
slick_surge,Slick Surge,acceleration_skill.png,Normal,Slightly increase acceleration late-race. (Late Surger),Increase acceleration (0.2),180,normal,,,buff,1.8s
on_your_left,On Your Left!,super_acceleration_skill.png,Upgraded,Increase acceleration late-race. (Late Surger),Increase acceleration (0.4),,upgrade,slick_surge,180,buff,1.8s
straightaway_spurt,Straightaway Spurt,acceleration_skill.png,Normal,Slightly increase acceleration on a straight in the last spurt. (End Closer),Increase acceleration (0.2),180,normal,,,buff,0.9s
encroaching_shadow,Encroaching Shadow,super_acceleration_skill.png,Upgraded,Increase acceleration on a straight in the last spurt. (End Closer),Increase acceleration (0.4),,upgrade,straightaway_spurt,180,buff,0.9s
sprinting_gear,Sprinting Gear,acceleration_skill.png,Normal,Slightly increase acceleration on a straight. (Sprint),Increase acceleration (0.2),160,normal,,,buff,3s
turbo_sprint,Turbo Sprint,super_acceleration_skill.png,Upgraded,Increase acceleration on a straight. (Sprint),Increase acceleration (0.4),,upgrade,sprinting_gear,160,buff,3s
updrafters,Updrafters,acceleration_skill.png,Normal,Slightly increase passing ability when positioned toward the back late-race. (Mile),Increase acceleration (0.2),160,normal,,,buff,3s
furious_feat,Furious Feat,super_acceleration_skill.png,Upgraded,Increase passing ability when positioned toward the back late-race. (Mile),Increase acceleration (0.4),,upgrade,updrafters,160,buff,3s
countermeasure,Countermeasure,acceleration_skill.png,Normal,Slightly increase passing ability when positioned toward the front upon approaching late-race. (Sprint),Increase acceleration (0.2),160,normal,,,buff,3s
plan_x,Plan X,super_acceleration_skill.png,Upgraded,Increase passing ability when positioned toward the front upon approaching late-race. (Sprint),Increase acceleration (0.4),,upgrade,countermeasure,160,buff,3s
acceleration,Acceleration,acceleration_skill.png,Normal,Slightly increase acceleration when passing another runner mid-race. (Mile),Increase acceleration (0.2),,normal,,,buff,3s
step_on_the_gas,Step on the Gas!,super_acceleration_skill.png,Upgraded,Increase acceleration when passing another runner mid-race. (Mile),Increase acceleration (0.4),,upgrade,acceleration,160,buff,3s
second_wind,Second Wind,acceleration_skill.png,Normal,Slightly increase acceleration when not in the lead mid-race. (Front Runner),Increase acceleration (0.2),180,normal,,,buff,3s
reignition,Reignition,super_acceleration_skill.png,Upgraded,Increase acceleration when not in the lead mid-race. (Front Runner),Increase acceleration (0.4),,upgrade,second_wind,180,buff,3s
shrewd_step,Shrewd Step,acceleration_skill.png,Normal,Slightly increase ability to navigate smoothly. (Pace Chaser),Increase acceleration (0.2),120,normal,,,buff,3s
technician,Technician,super_acceleration_skill.png,Upgraded,Moderately increase ability to navigate smoothly. (Pace Chaser),Increase acceleration (0.3),,upgrade,shrewd_step,120,buff,3s
straight_descent,Straight Descent,acceleration_skill.png,Normal,Slightly improve running on a downhill. (Pace Chaser),Increase acceleration (0.2),120,normal,,,buff,3s
determined_descent,Determined Descent,super_acceleration_skill.png,Upgraded,Moderately improve running on a downhill. (Pace Chaser),Increase acceleration (0.3),,upgrade,straight_descent,120,buff,3s
tactical_tweak,Tactical Tweak,acceleration_skill.png,Normal,Slightly increase acceleration when positioned toward the back mid-race. (Pace Chaser),Increase acceleration (0.2),120,normal,,,buff,3s
shatterproof,Shatterproof,super_acceleration_skill.png,Upgraded,Moderately increase acceleration when positioned toward the back mid-race. (Pace Chaser),Increase acceleration (0.3),,upgrade,tactical_tweak,120,buff,3s
fighter,Fighter,acceleration_skill.png,Normal,Slightly increase acceleration for a medium duration when trying to pass another runner. (Late Surger),Increase acceleration (0.2),120,normal,,,buff,4s
hard_worker,Hard Worker,super_acceleration_skill.png,Upgraded,Moderately increase acceleration for a medium duration when trying to pass another runner. (Late Surger),Increase acceleration (0.3),,upgrade,fighter,120,buff,4s
highlander,Highlander,acceleration_skill.png,Normal,Slightly improve running on an uphill.,Increase acceleration (0.2),160,normal,,,buff,3s
groundwork,Groundwork,acceleration_skill.png,Normal,Slightly increase acceleration after activating many skills early-race.,Increase acceleration (0.2),100,normal,,,buff,3s
head_on,Head-On,acceleration_skill.png,Normal,Slightly increase acceleration when positioned toward the front late-race. (Pace Chaser),Increase acceleration (0.2),180,normal,,,buff,1.8s
neck_and_neck,Neck and Neck,super_acceleration_skill.png,Upgraded,Increase acceleration when positioned toward the front late-race. (Pace Chaser),Increase acceleration (0.4),,upgrade,head_on,180,buff,1.8s
take_the_chance,Take the Chance,acceleration_skill.png,Normal,"If positioned toward the back late-race, slightly increase acceleration. (Medium)",Increase acceleration (0.2),160,normal,,,buff,1.2s
from_the_brink,From the Brink,super_acceleration_skill.png,Upgraded,"If positioned toward the back late-race, increase acceleration. (Medium)",Increase acceleration (0.4),,upgrade,take_the_chance,160,buff,1.2s
feel_the_burn,Feel the Burn!,unique_skill.png,Unique,Moderately increase acceleration in an attempt to move up on a corner late-race.,Increase acceleration (0.3),,normal,,,unique,4s
red_shift_lp1211_m,Red Shift/LP1211-M,unique_skill.png,Unique,Increase acceleration by shifting gears when positioned toward the front on the final corner or later.,Increase acceleration (0.4),,normal,,,unique,4s
shooting_for_victory,Shooting for Victory!,unique_skill.png,Unique,"Increase acceleration with a pow, a wow, and a bang when well-positioned upon approaching the final straight.",Increase acceleration (0.4),,normal,,,unique,4s
let_s_pump_some_iron,Let's Pump Some Iron!,unique_skill.png,Unique,Increase acceleration in an attempt to move up on a corner late-race.,Increase acceleration (0.4),,normal,,,unique,4s
angling_and_scheming,Angling and Scheming,unique_skill.png,Unique,Increase acceleration at an opportune moment when in the lead on a corner late-race.,Increase acceleration (0.4),,normal,,,unique,4s
condor_s_fury,Condor's Fury,unique_skill.png,Unique,Increase acceleration with blazing passion when aiming for the front from midpack on the final corner.,Increase acceleration (0.4),,normal,,,unique,4s
moving_past_and_beyond,"Moving Past, and Beyond",unique_skill.png,Unique,"Having run the race calmly, increase acceleration with hardened determination when making a move mid-race, or on a crucial corner late-race whilst in midpack.",Increase acceleration (0.4),,normal,,,unique,4s
budding_blossom,Budding Blossom,unique_skill.png,Unique,"If the user engaged in a challenge on a mid-race corner, increase acceleration when well-positioned late-race at least halfway through the final corner.",Increase acceleration (0.4),,normal,,,unique,4s
louder_tracen_cheer,Louder! Tracen Cheer!,unique_skill.png,Unique,"If the user stays toward the very back during the first half of the race without being rushed, unleash fighting spirit to increase acceleration on the final straight.",Increase acceleration (0.4),,normal,,,unique,4s
prudent_positioning,Prudent Positioning,navigation_skill.png,Normal,Increase navigation early-race.,Increase Lane Movement Speed (0.035),120,normal,,,buff,3s
center_stage,Center Stage,super_navigation_skill.png,Upgraded,Greatly increase navigation early-race.,Increase Lane Movement Speed (0.045),,upgrade,prudent_positioning,120,buff,3s
go_with_the_flow,Go with the Flow,navigation_skill.png,Normal,Moderately increase navigation late-race.,Increase Lane Movement Speed (0.025),120,normal,,,buff,3s
lane_legerdemain,Lane Legerdemain,super_navigation_skill.png,Upgraded,Increase navigation late-race.,Increase Lane Movement Speed (0.035),,upgrade,go_with_the_flow,120,buff,3s
meticulous_measures,Meticulous Measures,navigation_skill.png,Normal,Moderately prepare to make for the finish line for a medium duration mid-race. (Sprint),Increase Lane Movement Speed (0.025),140,normal,,,buff,4s
thunderbolt_step,Thunderbolt Step,navigation_skill.png,Normal,Moderately avoid becoming surrounded for a medium duration when positioned toward the back mid-race. (Medium),Increase Lane Movement Speed (0.025),140,normal,,,buff,4s
dodging_danger,Dodging Danger,navigation_skill.png,Normal,Moderately avoid becoming surrounded early-race. (Front Runner),Increase Lane Movement Speed (0.025),110,normal,,,buff,3s
forward_march,"Forward, March!",navigation_skill.png,Normal,Moderately prepare to aim for the front late-race. (Dirt),Increase Lane Movement Speed (0.025),140,normal,,,buff,3s
perfect_prep,Perfect Prep!,super_navigation_skill.png,Upgraded,Prepare to make for the finish line for a medium duration mid-race. (Sprint),Increase Lane Movement Speed (0.035),upgrade,meticulous_measures,140,buff,4s
lightning_step,Lightning Step,super_navigation_skill.png,Upgraded,Avoid becoming surrounded for a medium duration when positioned toward the back mid-race. (Medium),Increase Lane Movement Speed (0.035),upgrade,thunderbolt_step,140,buff,4s
sixth_sense,Sixth Sense,super_navigation_skill.png,Upgraded,Avoid becoming surrounded early-race. (Front Runner),Increase Lane Movement Speed (0.035),,upgrade,dodging_danger,110,buff,3s
lead_the_charge,Lead the Charge!,super_navigation_skill.png,Upgraded,Prepare to aim for the front late-race. (Dirt),Increase Lane Movement Speed (0.035),upgrade,forward_march,140,buff,3s
focus,Focus,start_skill.png,Normal,Slightly decrease time lost to slow starts.,Improve Start Reaction Time (0.9),140,normal,,,buff,
concentration,Concentration,super_start_skill.png,Upgraded,Decrease time lost to slow starts.,Improve Start Reaction Time (0.4),,upgrade,focus,140,buff,
gatekept,Gatekept,negative_start.png,Normal,Moderately increase time lost to slow starts.,Worsen Start Reaction Time (1.5),70,normal,,,negative,
feelin_a_bit_silly,Feelin' a Bit Silly,negative_start.png,Normal,Greatly decrease the racer's proficiency in starting races. Effects include slow starts and reduced starting acceleration. Removed at the end of the Career playthrough.,Decrease acceleration (-18),,normal,,,negative,2s
you_re_not_the_boss_of_me,You're Not the Boss of Me!,negative_start.png,Normal,Increase time lost to slow starts and moderately decrease Wit.,Decrease performance,0,normal,,,negative,
hawkeye,Hawkeye,vision_skill.png,Normal,Moderately widen field of view with heightened observation early-race. (Medium),Increase Field of View (10),110,normal,,,buff,3s
studious,Studious,vision_skill.png,Normal,Slightly widen field of view with heightened observation mid-race. (Late Surger),Increase Field of View (5),120,normal,,,buff,3s
i_can_see_right_through_you,I Can See Right Through You,vision_skill.png,Normal,Slightly widen field of view with situational awareness when moving sideways. (End Closer),Increase Field of View (5),110,normal,,,buff,3s
strategist,Strategist,vision_skill.png,Normal,Slightly widen field of view when positioned toward the back late-race. (End Closer),Increase Field of View (5),110,normal,,,buff,3s
clairvoyance,Clairvoyance,super_vision_skill.png,Upgraded,Widen field of view with heightened observation early-race. (Medium),Increase Field of View (15),,upgrade,hawkeye,110,buff,3s
the_bigger_picture,The Bigger Picture,super_vision_skill.png,Upgraded,Widen field of view with heightened observation mid-race. (Late Surger),Increase Field of View (15),,upgrade,studious,120,buff,3s
the_coast_is_clear,The Coast Is Clear!,super_vision_skill.png,Upgraded,Moderately widen field of view with situational awareness when moving sideways. (End Closer),Increase Field of View (10),,upgrade,i_can_see_right_through_you,110,buff,3s
crusader,Crusader,super_vision_skill.png,Upgraded,Widen field of view when positioned toward the back late-race. (End Closer),Increase Field of View (15),,upgrade,strategist,110,buff,3s
ignited_spirit_spd,Ignited Spirit SPD,ignited.png,Normal,"Burn bright with team spirit, slightly increasing velocity in proportion to the total Speed of racing team members mid-race.",Increase target speed (Special scaling),200,normal,,,buff,1.8s
ignited_spirit_guts,Ignited Spirit GUTS,ignited.png,Normal,"Burn bright with team spirit, very slightly increasing vigor in proportion to the total Guts of racing team members late-race.",Increase target speed (Special scaling),200,normal,,,buff,1.8s
burning_spirit_spd,Burning Spirit SPD,burning.png,Upgraded,"Burn bright with team spirit, increasing velocity in proportion to the total Speed of racing team members mid-race.",Increase target speed (Special scaling),200,normal,,,buff,1.8s
burning_spirit_guts,Burning Spirit GUTS,burning.png,Upgraded,"Burn bright with team spirit, increasing vigor in proportion to the total Guts of racing team members late-race.",Increase target speed (Special scaling),200,normal,,,buff,1.8s
ignited_spirit_sta,Ignited Spirit STA,ignited_stam.png,Normal,"Burn bright with team spirit, slightly recovering endurance in proportion to the total Stamina of racing team members mid-race.",Stamina recovery (Special scaling),200,normal,,,recovery,
burning_spirit_sta,Burning Spirit STA,burning_stam.png,Upgraded,"Burn bright with team spirit, recovering endurance in proportion to the total Stamina of racing team members mid-race.",Stamina recovery (Special scaling),200,normal,,,recovery,
ignited_spirit_pwr,Ignited Spirit PWR,ignited.png,Normal,"Burn bright with team spirit, slightly increasing acceleration in proportion to the total Power of racing team members late-race.",Increase acceleration (Special scaling),200,normal,,,buff,1.2s
burning_spirit_pwr,Burning Spirit PWR,burning.png,Upgraded,"Burn bright with team spirit, increasing acceleration in proportion to the total Power of racing team members late-race.",Increase acceleration (Special scaling),200,normal,,,buff,1.2s
ignited_spirit_wit,Ignited Spirit WIT,ignited_wit.png,Normal,"Burn bright with team spirit, slightly increasing strategic navigation for a medium duration in proportion to the total Wit of racing team members early-race.",,200,normal,,,buff,4s
burning_spirit_wit,Burning Spirit WIT,burning_wit.png,Upgraded,"Burn bright with team spirit, increasing strategic navigation for a medium duration in proportion to the total Wit of racing team members early-race.",,200,normal,,,buff,4s
glittering_star,Glittering Star,unique_skill.png,Normal,Very slightly control breathing and kick forward in the second half of the race. Effect is increased in proportion to number of career wins.,Increase target speed (Special scaling),200,normal,,,buff,1.2s
radiant_star,Radiant Star,unique_skill.png,Upgraded,Control breathing and kick forward in the second half of the race. Effect is increased in proportion to number of career wins.,Increase target speed (Special scaling),200,normal,,,buff,1.2s
hesitant_front_runners,Hesitant Front Runners,debuff_speed.png,Normal,Slightly decrease velocity of front runners late-race.,Decrease current speed (-0.15),130,normal,,,debuff,3s
hesitant_pace_chasers,Hesitant Pace Chasers,debuff_speed.png,Normal,Slightly decrease velocity of pace chasers late-race.,Decrease current speed (-0.15),130,normal,,,debuff,3s
hesitant_late_surgers,Hesitant Late Surgers,debuff_speed.png,Normal,Slightly decrease velocity of late surgers late-race.,Decrease current speed (-0.15),130,normal,,,debuff,3s
hesitant_end_closers,Hesitant End Closers,debuff_speed.png,Normal,Slightly decrease velocity of end closers late-race.,Decrease current speed (-0.15),130,normal,,,debuff,3s
intimidate,Intimidate,debuff_speed.png,Normal,Moderately intimidate runners behind when positioned toward the front early-race. (Sprint),Decrease current speed (-0.2),170,normal,,,debuff,3s
speed_eater,Speed Eater,debuff_speed.png,Normal,Slightly steal velocity from runners behind when positioned toward the front mid-race. (Mile),Decrease current speed (-0.15),160,normal,,,debuff,3s
greed_for_speed,Greed for Speed,super_debuff_speed.png,Upgraded,Moderately steal velocity from runners behind when positioned toward the front mid-race. (Mile),Decrease current speed (-0.2),,upgrade,speed_eater,160,debuff,3s
tether,Tether,debuff_speed.png,Normal,Slightly decrease velocity of runners ahead when positioned toward the back late-race. (Medium),Decrease current speed (-0.15),160,normal,,,debuff,3s
dominator,Dominator,super_debuff_speed.png,Upgraded,Decrease velocity of runners ahead when positioned toward the back late-race. (Medium),Decrease current speed (-0.25),,upgrade,tether,160,debuff,3s
intense_gaze,Intense Gaze,debuff_speed.png,Normal,Slightly unnerve runners in focus late-race. (End Closer),Decrease current speed (-0.15),180,normal,,,debuff,3s
petrifying_gaze,Petrifying Gaze,super_debuff_speed.png,Upgraded,Unnerve runners in focus late-race. (End Closer),Decrease current speed (-0.25),upgrade,intense_gaze,180,debuff,3s
adored_by_all,Adored by All,super_debuff_speed.png,Upgraded,Intimidate runners behind when positioned toward the front early-race. (Sprint),Decrease current speed (-0.25),upgrade,intimidate,170,debuff,3s
opening_gambit,Opening Gambit,debuff_acceleration.png,Normal,Slightly dull movement for runners ahead when positioned toward the back early-race. (Mile),Decrease acceleration (-0.1),160,normal,,,debuff,3s
restart,Restart,debuff_acceleration.png,Normal,Slightly dull movement for runners ahead when not in the lead early-race. (Front Runner),Decrease acceleration (-0.1),130,normal,,,debuff,3s
battle_formation,Battle Formation,super_debuff_acceleration.png,Upgraded,Dull movement for runners ahead when positioned toward the back early-race. (Mile),Decrease acceleration (-0.3),160,normal,,,debuff,3s
frenzied_front_runners,Frenzied Front Runners,debuff_wit.png,Normal,Increase time needed for front runners to calm down when they become rushed.,Increase Rush Time (5),130,normal,,,debuff,
frenzied_pace_chasers,Frenzied Pace Chasers,debuff_wit.png,Normal,Increase time needed for pace chasers to calm down when they become rushed.,Increase Rush Time (5),130,normal,,,debuff,
frenzied_late_surgers,Frenzied Late Surgers,debuff_wit.png,Normal,Increase time needed for late surgers to calm down when they become rushed.,Increase Rush Time (5),130,normal,,,debuff,
frenzied_end_closers,Frenzied End Closers,debuff_wit.png,Normal,Increase time needed for end closers to calm down when they become rushed.,Increase Rush Time (5),130,normal,,,debuff,
trick_front,Trick (Front),debuff_stamina.png,Normal,Slightly increase fatigue for rushed runners behind when positioned toward the front mid-race.,Stamina Drain (-0.01),140,normal,,,debuff,
tantalizing_trick,Tantalizing Trick,super_debuff_stamina.png,Upgraded,Increase fatigue for rushed runners behind when positioned toward the front mid-race.,Stamina Drain (-0.03),,upgrade,trick_front,140,debuff,
trick_rear,Trick (Rear),debuff_stamina.png,Normal,Slightly increase fatigue for rushed runners ahead when positioned toward the back mid-race.,Stamina Drain (-0.01),140,normal,,,debuff,
subdued_front_runners,Subdued Front Runners,debuff_stamina.png,Normal,Slightly increase fatigue for front runners early-race.,Stamina Drain (-0.01),130,normal,,,debuff,
flustered_front_runners,Flustered Front Runners,debuff_stamina.png,Normal,Slightly increase fatigue for front runners mid-race.,Stamina Drain (-0.01),130,normal,,,debuff,
subdued_pace_chasers,Subdued Pace Chasers,debuff_stamina.png,Normal,Slightly increase fatigue for pace chasers early-race.,Stamina Drain (-0.01),130,normal,,,debuff,
flustered_pace_chasers,Flustered Pace Chasers,debuff_stamina.png,Normal,Slightly increase fatigue for pace chasers mid-race.,Stamina Drain (-0.01),130,normal,,,debuff,
subdued_late_surgers,Subdued Late Surgers,debuff_stamina.png,Normal,Slightly increase fatigue for late surgers early-race.,Stamina Drain (-0.01),130,normal,,,debuff,
flustered_late_surgers,Flustered Late Surgers,debuff_stamina.png,Normal,Slightly increase fatigue for late surgers mid-race.,Stamina Drain (-0.01),130,normal,,,debuff,
subdued_end_closers,Subdued End Closers,debuff_stamina.png,Normal,Slightly increase fatigue for end closers early-race.,Stamina Drain (-0.01),130,normal,,,debuff,
flustered_end_closers,Flustered End Closers,debuff_stamina.png,Normal,Slightly increase fatigue for end closers mid-race.,Stamina Drain (-0.01),130,normal,,,debuff,
stop_right_there,Stop Right There!,debuff_stamina.png,Normal,Slightly cause panic in and very slightly dull movement for runners ahead when positioned toward the back early-race. (Sprint),Stamina Drain (-0.01) and Decrease Acceleration (-0.1),170,normal,,,debuff,1.2s
