id,name,icon,rarity,description,effect,skill_points,type,parent_id,required_sp,category,base_duration
trackblazer,Trackblazer,super_recovery_stamina.png,Upgraded,Decrease fatigue when positioned toward the front mid-race. [Activate when your uma is at 3rd pos in both CM and LoH or better] (Medium),Stamina recovery (0.055),,upgrade,rosy_outlook,160,recovery
rosy_outlook,Rosy Outlook,recovery_stamina.png,Normal,Slightly decrease fatigue when positioned toward the front mid-race. [Activate when your uma is at 3rd pos in both CM and LoH or better] (Medium),Stamina recovery (0.015),160,normal,,,recovery
cooldown,Cooldown,super_recovery_stamina.png,Upgraded,Decrease fatigue by taking a breather upon entering a straight. [Activates randomly during a straight in mid-race] (Long),Stamina recovery (0.055),,upgrade,deep_breaths,160,recovery
deep_breaths,Deep Breaths,recovery_stamina.png,Normal,Slightly decrease fatigue by taking a breather upon entering a straight [Activates randomly during a straight in mid-race.]. (Long),Stamina recovery (0.015),160,normal,,,recovery
adrenaline_rush,Adrenaline Rush,super_recovery_stamina.png,Upgraded,Regain the energy to run when close to exhausting strength. [Activates when your stamina is <= 30%] (Long),Stamina recovery (0.055),,upgrade,extra_tank,160,recovery
extra_tank,Extra Tank,recovery_stamina.png,Normal,Slightly regain the energy to run when close to exhausting strength. [Activates when your stamina is <= 30%] (Long),Stamina recovery (0.015),160,normal,,,recovery

miraculous_step,Miraculous Step,super_recovery_stamina.png,Upgraded,Decrease fatigue when moving sideways. [Activates while changing lanes after 10s into the race] (Medium),Stamina recovery (0.055),,upgrade,soft_step,160,recovery
soft_step,Soft Step,recovery_stamina.png,Normal,Slightly decrease fatigue when moving sideways. [Activates while changing lanes after 10s into the race] (Medium),Stamina recovery (0.015),160,normal,,,recovery
vip_pass,VIP Pass,super_recovery_stamina.png,Upgraded,Decrease fatigue when determined to pass another runner. (Long),Stamina recovery (0.055),,upgrade,passing_pro,160,recovery
passing_pro,Passing Pro,recovery_stamina.png,Normal,Slightly decrease fatigue when determined to pass another runner. (Long),Stamina recovery (0.015),160,normal,,,recovery
restless,Restless,super_recovery_stamina.png,Upgraded,Reduce fatigue on an uphill. [Activates while running uphill after 10s into the race] (Front Runner),Stamina recovery (0.055),,upgrade,moxie,170,recovery
moxie,Moxie,recovery_stamina.png,Normal,Slightly reduce fatigue on an uphill. [Activates while running uphill after 10s into the race] (Front Runner),Stamina recovery (0.015),170,normal,,,recovery
gourmand,Gourmand,super_recovery_stamina.png,Upgraded,Recover endurance mid-race. [Activate at a random point in mid-race] (Pace Chaser),Stamina recovery (0.055),,upgrade,hydrate,180,recovery
hydrate,Hydrate,recovery_stamina.png,Normal,Slightly recover endurance mid-race. [Activate at a random point in mid-race] (Pace Chaser),Stamina recovery (0.015),180,normal,,,recovery
relax,Relax,super_recovery_stamina.png,Upgraded,Recover endurance late-race. [Activates at a random point in late-race] (Late Surger),Stamina recovery (0.055),,upgrade,a_small_breather,180,recovery
a_small_breather,A Small Breather,recovery_stamina.png,Normal,Slightly recover endurance late-race. [Activates at a random point in late-race] (Late Surger),Stamina recovery (0.015),180,normal,,,recovery
go_home_specialist,Go-Home Specialist,super_recovery_stamina.png,Upgraded,Reduce fatigue on a downhill. [Activates while running downhill after 10s have elapsed] (End Closer),Stamina recovery (0.055),,upgrade,after_school_stroll,180,recovery
after_school_stroll,After-School Stroll,recovery_stamina.png,Normal,Slightly reduce fatigue on a downhill. [Activates while running downhill after 10s have elapsed] (End Closer),Stamina recovery (0.015),180,normal,,,recovery
serenity,Serenity,super_recovery_stamina.png,Upgraded,Regain composure by calming down when the way ahead is jammed. [Activates when your uma is blocked in 1s after 10s into the race] (End Closer),Stamina recovery (0.055),,upgrade,levelheaded,180,recovery
levelheaded,Levelheaded,recovery_stamina.png,Normal,Slightly regain composure by calming down when the way ahead is jammed. [Activates when your uma is blocked in 1s after 10s into the race] (End Closer),Stamina recovery (0.015),180,normal,,,recovery
triple_7s,Triple 7s,recovery_stamina.png,Normal,Slightly gain energy with 777m remaining.,Stamina recovery (0.015),160,normal,,,recovery
shake_it_out,Shake It Out,recovery_stamina.png,Normal,Slightly recover endurance after activating many skills late-race. [Activates when 3 late-race skills are activated],Stamina recovery (0.015),100,normal,,,recovery

lie_in_wait,Lie in Wait,super_recovery_stamina.png,Upgraded,Recover endurance when positioned toward the back upon approaching mid-race. [Activates when your uma is in 5th pos in CM and 6th pos in LoH or worse at a random point in latter early-race.] (Late Surger),Stamina recovery (0.055),,upgrade,be_still,180,recovery
be_still,Be Still,recovery_stamina.png,Normal,Slightly recover endurance when positioned toward the back upon approaching mid-race. [Activates when your uma is in 5th pos in CM and 6th pos in LoH or worse at a random point in latter early-race.] (Late Surger),Stamina recovery (0.015),180,normal,,,recovery
master_of_the_sands,Master of the Sands,super_recovery_stamina.png,Unique,Recover endurance and increase velocity when positioned toward the back mid-race. [Activates when your uma is in 5th pos in CM and 6th pos in LoH or worse at a random point in mid-race] (Dirt),Stamina recovery (0.055) and Increase Target Speed (0.35),,upgrade,familiar_ground,180,recovery
familiar_ground,Familiar Ground,recovery_stamina.png,Normal,Slightly recover endurance when positioned toward the back mid-race. [Activates when your uma is in 5th pos in CM and 6th pos in LoH or worse at a random point in mid-race] (Dirt),Stamina recovery (0.015),180,normal,,,recovery
of_calm_mind,Of Calm Mind,recovery_stamina.png,Upgraded,If positioned in the midpack around when the mid-race starts, slightly decrease velocity and greatly recover endurance. [Activates when your uma is from 4 <= pos <= 7 in CM and 5 <= pos <= 10 in LoH at a random point in former mid-race] (Long),Stamina recovery (0.075) and Speed Decrease (-0.15),,upgrade,free_spirited,170,recovery
free_spirited,Free-Spirited,recovery_stamina.png,Normal,If positioned in the midpack around when the mid-race starts slightly decrease velocity and moderately recover endurance. (Long),Stamina recovery (0.035) and Speed debuff (-0.15),170,normal,,,recovery

corner_adept,Corner Adept ○,speed_skill.png,Normal,Slightly increase velocity on a corner with skilled turning. [Activates on a random corner],Increase target speed (0.15),180,normal,,,buff,2.4s
straightaway_adept,Straightaway Adept,speed_skill.png,Normal,Slightly increase velocity on a straight. [Activates on a random straight],Increase target speed (0.15),170,normal,,,buff,2.4s
ramp_up,Ramp Up,speed_skill.png,Normal,Slightly increase velocity when passing another runner mid-race.,Increase target speed (0.15),170,normal,,,buff,1.8s 
homestretch_haste,Homestretch Haste,speed_skill.png,Normal,Slightly increase velocity in the last spurt.,Increase target speed (0.15),180,normal,,,buff,2.4s
fast_paced,Fast-Paced,speed_skill.png,Normal,Slightly increase ability to go to the front mid-race. [Activates when your uma is 5th pos in CM and 6th pos in LoH or higher at a random point in mid-race] (Front Runner),Increase target speed (0.15),180,normal,,,buff,3s
prepared_to_pass,Prepared to Pass,speed_skill.png,Normal,Slightly increase ability to break out of the pack on the final corner. [Activates when your uma is in 5th pos in CM and 6th pos in LoH at a random point in the final corner] (Pace Chaser),Increase target speed (0.15),180,normal,,,buff,1.8
position_pilfer,Position Pilfer,speed_skill.png,Normal,Slightly increase velocity mid-race. [Activates when your uma is in 6th pos in CM and 7th pos in LoH at random point in mid-race] (Late Surger),Increase target speed (0.15),180,normal,,,buff,2.4
outer_swell,Outer Swell,speed_skill.png,Normal,Slightly increase velocity when passing another runner on the outside on the final corner. [Activates when your uma has passed another uma after reaching the final corner and the uma you have passed is more inner fence than yours.] (Late Surger),Increase target speed (0.15),180,normal,,,buff,3s
masterful_gambit,Masterful Gambit,speed_skill.png,Normal,Slightly move up in preparation to close the gap when positioned toward the back late-race. [Activates when your uma has a distance >= 50m with 1st pos uma at late-race] (End Closer),Increase target speed (0.15),180,normal,,,buff,3s
gap_closer,Gap Closer,speed_skill.png,Normal,Slightly increase spurting ability when positioned toward the back late-race. [Activates when your uma is 6th pos in CM and 7th pos in LoH or worse at a random point in late-race] (Sprint),Increase target speed (0.15) and Acceleration (0.05),160,normal,,,buff,3s
productive_plan,Productive Plan,speed_skill.png,Normal,Slightly widen the margin when positioned toward the front early-race. [Activates when your uma is 5th pos in CM and 6th pos in LoH or better at a random point in early-race after 5s into the race] (Mile),Increase target speed (0.15),160,normal,,,buff,3s
up_tempo,Up-Tempo,speed_skill.png,Normal,Slightly increase positioning ability when positioned toward the front mid-race. [Activates when your uma is 5th pos in CM and 6th pos in LoH or better at a random point in mid-race] (Medium),Increase target speed (0.15),160,normal,,,buff,2.4s
steadfast,Steadfast,speed_skill.png,Normal,Slightly increase ability to fight back when passed by another runner on the final corner. [Activates when your uma is being passed by another uma at the final corner] (Medium),Increase target speed (0.15) and Acceleration (0.05),160,normal,,,buff,3s
inside_scoop,Inside Scoop,speed_skill.png,Normal,Slightly increase velocity when near the inner rail on the final corner. [Activates when your uma runs near the fench at the final corner] (Long),Increase target speed (0.15),160,normal,,,buff,3s
shifting_gears,Shifting Gears,speed_skill.png,Normal,Slightly increase passing ability when positioned toward the front mid-race. [Activates when your uma is 5th pos in CM and 6th pos in LoH at a random point in mid-race] (Mile),Increase target speed (0.15),160,normal,,,buff,2.4s
unyielding_spirit,Unyielding Spirit,speed_skill.png,Normal,Slightly increase passing ability. [Activates when your uma is going to pass another uma after 5s into the race] (Mile),Increase target speed (0.15),120,normal,,,buff,2.4s

keeping_the_lead,Keeping the Lead,speed_skill.png,Normal,Slightly increase ability to maintain the lead when leading by a fair margin mid-race. (Long),Increase target speed (0.15),160,normal,,,buff,2.4s
pressure,Pressure,speed_skill.png,Normal,Slightly increase velocity when passing another runner late-race. (Long),Increase target speed (0.15),180,normal,,,buff,2.4s
huge_lead,Huge Lead,speed_skill.png,Normal,Slightly increase ability to maintain the lead when leading by a large margin mid-race. (Sprint),Increase target speed (0.15),180,normal,,,buff,2.4s

sprint_straightaways_o,Sprint Straightaways ◎,speed_skill.png,Upgraded,Moderately increase velocity on a straight. [Activates on a random straight] (Sprint),Increase target speed (0.25),,upgrade,sprint_straightaways,110,buff,3s
sprint_straightaways,Sprint Straightaways ○,speed_skill.png,Normal,Slightly increase velocity on a straight. [Activates on a random straight] (Sprint),Increase target speed (0.15),100,normal,,,buff,3s
sprint_corners_o,Sprint Corners ◎,speed_skill.png,Upgraded,Moderately increase velocity on a corner. [Activates on a random corner] (Sprint),Increase target speed (0.25),,upgrade,sprint_corners,110,buff,3s
sprint_corners,Sprint Corners ○,speed_skill.png,Normal,Slightly increase velocity on a corner. [Activates on a random corner] (Sprint),Increase target speed (0.15),100,normal,,,buff,3s
mile_straightaways_o,Mile Straightaways ◎,speed_skill.png,Upgraded,Moderately increase velocity on a straight. [Activates on a random straight] (Mile),Increase target speed (0.25),,upgrade,mile_straightaways,110,buff,3s
mile_straightaways,Mile Straightaways ○,speed_skill.png,Normal,Slightly increase velocity on a straight. [Activates on a random straight] (Mile),Increase target speed (0.15),100,normal,,,buff,3s
mile_corners_o,Mile Corners ◎,speed_skill.png,Upgraded,Moderately increase velocity on a corner. [Activates on a random corner] (Mile),Increase target speed (0.25),,upgrade,mile_corners,110,buff,3s
mile_corners,Mile Corners ○,speed_skill.png,Normal,Slightly increase velocity on a corner. [Activates on a random corner] (Mile),Increase target speed (0.15),100,normal,,,buff,3s
medium_straightaways_o,Medium Straightaways ◎,speed_skill.png,Upgraded,Moderately increase velocity on a straight. [Activates on a random straight] (Medium),Increase target speed (0.25),,upgrade,medium_straightaways,110,buff,3s
medium_straightaways,Medium Straightaways ○,speed_skill.png,Normal,Slightly increase velocity on a straight. [Activates on a random straight] (Medium),Increase target speed (0.15),100,normal,,,buff,3s
medium_corners_o,Medium Corners ◎,speed_skill.png,Upgraded,Moderately increase velocity on a corner. [Activates on a random corner]  (Medium),Increase target speed (0.25),,upgrade,medium_corners,110,buff,3s
medium_corners,Medium Corners ○,speed_skill.png,Normal,Slightly increase velocity on a corner. [Activates on a random corner] (Medium),Increase target speed (0.15),100,normal,,,buff,3s
long_straightaways_o,Long Straightaways ◎,speed_skill.png,Upgraded,Moderately increase velocity on a straight. [Activates on a random straight] (Long),Increase target speed (0.25),,upgrade,long_straightaways,110,buff,3s
long_straightaways,Long Straightaways ○,speed_skill.png,Normal,Slightly increase velocity on a straight. [Activates on a random straight] (Long),Increase target speed (0.15),100,normal,,,buff,3s
long_corners_o,Long Corners ◎,speed_skill.png,Upgraded,Moderately increase velocity on a corner. [Activates on a random corner] (Long),Increase target speed (0.25),,upgrade,long_corners,110,buff,3s
long_corners,Long Corners ○,speed_skill.png,Normal,Slightly increase velocity on a corner. [Activates on a random corner] (Long),Increase target speed (0.15),100,normal,,,buff,3s
front_runner_straightaways_o,Front Runner Straightaways ◎,speed_skill.png,Upgraded,Moderately increase velocity on a straight. [Activates on a random straight] (Front Runner),Increase target speed (0.25),,upgrade,front_runner_straightaways,140,buff,3s
front_runner_straightaways,Front Runner Straightaways ○,speed_skill.png,Normal,Slightly increase velocity on a straight. [Activates on a random straight] (Front Runner),Increase target speed (0.15),130,normal,,,buff,3s


introduction_to_physiology,Introduction to Physiology,unique_skill_heal.png,Unique,Moderately recover endurance and slightly increase velocity for a moderate duration when sitting off the pace on a corner in the second half of the race.,Stamina recovery (0.035),,normal,,,unique,4s
clear_heart,Clear Heart,unique_skill_heal.png,Unique,Recover endurance when well-positioned mid-race.,Stamina recovery (0.055),,normal,,,unique,
super_duper_stoked,Super-Duper Stoked,unique_skill_heal.png,Unique,Moderately recover endurance with a glance at nearby runners when positioned toward the back on the final corner.,Stamina recovery (0.035),,normal,,,unique,
u_ma2,U=ma2,unique_skill_heal.png,Unique,Recover endurance and moderately increase velocity for a moderate duration when sitting off the pace on a corner in the second half of the race.,Stamina recovery (0.055),,normal,,,unique,4s
pure_heart,Pure Heart,unique_skill_heal.png,Unique,Greatly recover endurance when well-positioned mid-race.,Stamina recovery (0.075),,normal,,,unique,
super_duper_climax,Super-Duper Climax,unique_skill_heal.png,Unique,Recover endurance with a glance at nearby runners when positioned toward the back on the final corner.,Stamina recovery (0.055),,normal,,,unique,
running_idle,Running Idle,negative_recovery.png,Negative,Moderately increase fatigue when in the lead by too large of a margin.,Stamina Drain (-0.02),100,normal,,,negative,
superior_heal,Superior Heal,unique_skill_heal.png,Unique,Greatly recover endurance with a gentle light when overtaken toward the back mid-race.,Stamina recovery (0.075),,normal,,,unique,
dazzl_n_diver,Dazzl'n ♪ Diver,unique_skill_heal.png,Unique,Recover endurance by relaxing after activating 2 skills when positioned midpack mid-race.,Stamina recovery (0.055),,normal,,,unique,
every_rose_has_its_fangs,Every Rose Has Its Fangs,unique_skill_heal.png,Unique,Suck endurance from runners ahead when well-positioned and pressured by another runner mid-race.,Stamina recovery (0.055),,normal,,,unique,
cheers_of_a_fellow_dreamer,Cheers of a Fellow Dreamer,super_recovery_stamina.png,Upgraded,Recover Silence Suzuka's endurance on a corner in the second half of the race through a friend's cheers of support.,Stamina recovery (0.055),,normal,,,recovery,
ready_go,"Ready, Go!",unique_skill_heal.png,Unique,Moderately recover endurance and slightly increase velocity with newfound resolve when in midpack around halfway through the race.,Stamina recovery (0.035),,normal,,,unique,5s
go_go_mun,"Go, Go, Mun!",unique_skill_heal.png,Unique,Recover endurance and moderately increase velocity with newfound resolve when in midpack around halfway through the race.,Stamina recovery (0.055),,normal,,,unique,5s
keep_pushing_ahead,Keep Pushing Ahead,unique_skill.png,Unique,"If positioned toward the front from the start of the race until the second half of the race, good vibes recover endurance and moderately increase velocity steadily.",Stamina recovery (0.055),,normal,,,unique,6s
front_runner_corners,Front Runner Corners ○,speed_skill.png,Normal,Slightly increase velocity on a corner. (Front Runner),Increase target speed (0.15),130,normal,,,buff,3s
front_runner_corners_o,Front Runner Corners ◎,speed_skill.png,Upgraded,Moderately increase velocity on a corner. (Front Runner),Increase target speed (0.25),,upgrade,front_runner_corners,140,buff,3s
leader_s_pride,Leader's Pride,speed_skill.png,Normal,Slightly increase ability to pass or challenge another runner early-race or mid-race. (Front Runner),Increase target speed (0.15),180,normal,,,buff,3s
top_runner,Top Runner,super_speed_skill.png,Upgraded,Increase ability to pass or challenge another runner early-race or mid-race. (Front Runner),Increase target speed (0.35),,upgrade,leader_s_pride,180,buff,3s
pace_chaser_straightaways,Pace Chaser Straightaways ○,speed_skill.png,Normal,Slightly increase velocity on a straight. (Pace Chaser),Increase target speed (0.15),130,normal,,,buff,3s
pace_chaser_straightaways_o,Pace Chaser Straightaways ◎,speed_skill.png,Upgraded,Moderately increase velocity on a straight. (Pace Chaser),Increase target speed (0.25),,upgrade,pace_chaser_straightaways,140,buff,3s
pace_chaser_corners,Pace Chaser Corners ○,speed_skill.png,Normal,Slightly increase velocity on a corner. (Pace Chaser),Increase target speed (0.15),130,normal,,,buff,3s
pace_chaser_corners_o,Pace Chaser Corners ◎,speed_skill.png,Upgraded,Moderately increase velocity on a corner. (Pace Chaser),Increase target speed (0.25),,upgrade,pace_chaser_corners,140,buff,3s
late_surger_straightaways,Late Surger Straightaways ○,speed_skill.png,Normal,Slightly increase velocity on a straight. (Late Surger),Increase target speed (0.15),130,normal,,,buff,3s
late_surger_straightaways_o,Late Surger Straightaways ◎,speed_skill.png,Upgraded,Moderately increase velocity on a straight. (Late Surger),Increase target speed (0.25),,upgrade,late_surger_straightaways,140,buff,3s
late_surger_corners,Late Surger Corners ○,speed_skill.png,Normal,Slightly increase velocity on a corner. (Late Surger),Increase target speed (0.15),130,normal,,,buff,3s
late_surger_corners_o,Late Surger Corners ◎,speed_skill.png,Upgraded,Moderately increase velocity on a corner. (Late Surger),Increase target speed (0.25),,upgrade,late_surger_corners,140,buff,3s
1_500_000_cc,"1,500,000 CC",speed_skill.png,Normal,Slightly increase velocity on an uphill. (Late Surger),Increase target speed (0.15),120,normal,,,buff,2.4s
15_000_000_cc,"15,000,000 CC",super_speed_skill.png,Upgraded,Increase velocity on an uphill. (Late Surger),Increase target speed (0.35),,upgrade,1_500_000_cc,120,buff,2.4s
end_closer_straightaways,End Closer Straightaways ○,speed_skill.png,Normal,Slightly increase velocity on a straight. (End Closer),Increase target speed (0.15),130,normal,,,buff,3s
end_closer_straightaways_o,End Closer Straightaways ◎,speed_skill.png,Upgraded,Moderately increase velocity on a straight. (End Closer),Increase target speed (0.25),,upgrade,end_closer_straightaways,140,buff,3s
moonlit_flash,Moonlit Flash,super_speed_skill.png,Upgraded,Increase velocity on straights. (End Closer),Increase target speed (0.35),,upgrade,end_closer_straightaways,150,buff,3s
end_closer_corners,End Closer Corners ○,speed_skill.png,Normal,Slightly increase velocity on a corner. (End Closer),Increase target speed (0.15),130,normal,,,buff,3s
end_closer_corners_o,End Closer Corners ◎,speed_skill.png,Upgraded,Moderately increase velocity on a corner. (End Closer),Increase target speed (0.25),,upgrade,end_closer_corners,140,buff,3s
uma_stan,Uma Stan,speed_skill.png,Normal,Slightly increase velocity when close to many runners.,Increase target speed (0.15),160,normal,,,buff,3s
superstan,Superstan,super_speed_skill.png,Upgraded,Increase velocity when close to many runners.,Increase target speed (0.35),,upgrade,uma_stan,160,buff,3s
tail_held_high,Tail Held High,speed_skill.png,Normal,Slightly increase velocity after activating many skills mid-race.,Increase target speed (0.15),100,normal,,,buff,3s
tail_nine,Tail Nine,super_speed_skill.png,Upgraded,Increase velocity after activating many skills mid-race.,Increase target speed (0.35),,upgrade,tail_held_high,180,buff,3s
slipstream,Slipstream,speed_skill.png,Normal,Slightly decrease wind resistance when following directly behind another runner.,Increase target speed (0.15),160,normal,,,buff,3s
playtime_s_over,Playtime's Over!,speed_skill.png,Normal,Slightly increase velocity when followed by another runner directly behind for a long time.,Increase target speed (0.15),160,normal,,,buff,3s
see_ya_later,See Ya Later!,super_speed_skill.png,Upgraded,Increase velocity when followed by another runner directly behind for a long time.,Increase target speed (0.35),,upgrade,playtime_s_over,160,buff,3s
top_pick,Top Pick,speed_skill.png,Normal,Slightly increase velocity when engaged in a challenge mid-race. (Dirt),Increase target speed (0.15),180,normal,,,buff,2.4s
trending_in_the_charts,Trending in the Charts!,super_speed_skill.png,Upgraded,Increase velocity when engaged in a challenge mid-race. (Dirt),Increase target speed (0.35),,upgrade,top_pick,180,buff,2.4s
all_i_ve_got,All I've Got,speed_skill.png,Normal,Slightly increase velocity when well-positioned on a straight in the last spurt. (Medium),Increase target speed (0.15),160,normal,,,buff,2.4s
come_what_may,Come What May,super_speed_skill.png,Upgraded,Increase velocity when well-positioned on a straight in the last spurt. (Medium),Increase target speed (0.35),,upgrade,all_i_ve_got,160,buff,2.4s
feature_act,Feature Act,speed_skill.png,Normal,Slightly increase velocity when positioned toward the front upon approaching late-race. (Long),Increase target speed (0.15),160,normal,,,buff,2.4s
headliner,Headliner,speed_skill.png,Upgraded,Increase velocity when positioned toward the front upon approaching late-race. (Long),Increase target speed (0.35),,upgrade,feature_act,160,buff,2.4s
early_start,Early Start,speed_skill.png,Normal,Very slightly increase velocity for a medium duration when positioned toward the back mid-race. (End Closer),Increase target speed (0.05),180,normal,,,buff,4s
daring_strike,Daring Strike,super_speed_skill.png,Upgraded,Moderately increase velocity for a medium duration when positioned toward the back mid-race. (End Closer),Increase target speed (0.25),,upgrade,early_start,180,buff,4s
risky_business,Risky Business,speed_skill.png,Normal,"Moderately increase velocity in the second half of the race, but also greatly increase fatigue sometimes.",Increase target speed (0.25),120,normal,,,buff,1.8s
nothing_ventured,Nothing Ventured,super_speed_skill.png,Upgraded,"Greatly increase velocity in the second half of the race, but also greatly increase fatigue sometimes.",Increase target speed (0.45),,upgrade,risky_business,120,buff,1.8s
light_as_a_feather,Light as a Feather,speed_skill.png,Normal,Slightly increase velocity when positioned toward the front upon approaching late-race. (Sprint),Increase target speed (0.15),160,normal,,,buff,2.4s
in_high_spirits,In High Spirits,super_speed_skill.png,Upgraded,Increase velocity when positioned toward the front upon approaching late-race. (Sprint),Increase target speed (0.35),,upgrade,light_as_a_feather,160,buff,2.4s
fighting_spirit,Fighting Spirit,speed_skill.png,Normal,"When engaged in a challenge midpack mid-race, very slightly recover endurance and slightly increase velocity. (Medium)",Increase target speed (0.15),160,normal,,,buff,1.8s
