id,name,icon,rarity,description,effect,skill_points,type,parent_id,required_sp,category,base_duration
right_handed,Right-Handed ○,stat_speed.png,Normal,Moderately increase performance on right-handed tracks.,Give stat Speed boost (40),90,normal,,
right_handed_o,Right-Handed ◎,stat_speed.png,Upgraded,Increase performance on right-handed tracks.,Give stat Speed boost (60),,upgrade,right_handed,110
right_handed_demon,Right-Handed Demon,super_stat_speed.png,Upgraded,"Increase proficiency in right-handed tracks, increasing Speed and Power.",Give stat Speed boost (60) and Power boost (60),,upgrade,right_handed,130

left_handed_o,Left-Handed ◎,stat_speed.png,Upgraded,Increase performance on left-handed tracks.,Give stat Speed boost (60),,upgrade,left_handed,110
left_handed,Left-Handed ○,stat_speed.png,Normal,Moderately increase performance on left-handed tracks.,Give stat Speed boost (40),90,normal,,

spring_runner_o,Spring Runner ◎,stat_speed.png,Upgraded,Increase performance in spring.,Give stat Speed boost (60),,upgrade,spring_runner,110
spring_runner,Spring Runner ○,stat_speed.png,Normal,Moderately increase performance in spring.,Give stat Speed boost (40),90,normal,,
spring_spectacle,Spring Spectacle,super_stat_speed.png,Upgraded,"Increase performance in spring, boosting Speed and Power.",Give stat Speed boost (60) and Power boost (60),,upgrade,spring_runner,130

summer_runner_o,Summer Runner ◎,stat_speed.png,Upgraded,Increase performance in summer.,Give stat Speed boost (60),,upgrade,summer_runner,110
summer_runner,Summer Runner ○,stat_speed.png,Normal,Moderately increase performance in summer.,Give stat Speed boost (40),90,normal,,

fall_runner_o,Fall Runner ◎,stat_speed.png,Upgraded,Increase performance in fall.,Give stat Speed boost (60),,upgrade,fall_runner,110
fall_runner,Fall Runner ○,stat_speed.png,Normal,Moderately increase performance in fall.,Give stat Speed boost (40),90,normal,,
fall_frenzy,Fall Frenzy,super_stat_speed.png,Upgraded,"Increase performance in fall, boosting Speed and Power.",Give stat Speed boost (60) and Power boost (60),,upgrade,fall_runner,130

winter_runner_o,Winter Runner ◎,stat_speed.png,Upgraded,Increase performance in winter.,Give stat Speed boost (60),,upgrade,winter_runner,110
winter_runner,Winter Runner ○,stat_speed.png,Normal,Moderately increase performance in winter.,Give stat Speed boost (40),90,normal,,

outer_post_proficiency_o,Outer Post Proficiency ◎,stat_speed.png,Upgraded,Increase performance in brackets 6-8.,Give stat Speed boost (60),,upgrade,outer_post_proficiency,110
outer_post_proficiency,Outer Post Proficiency ○,stat_speed.png,Normal,Moderately increase performance in brackets 6-8.,Give stat Speed boost (40),90,normal,,

maverick_o,Maverick ◎,stat_speed.png,Upgraded,Greatly increase performance when no other runners are using the same strategy.,Give stat Speed boost (60),,upgrade,maverick,110
maverick,Maverick ○,stat_speed.png,Normal,Increase performance when no other runners are using the same strategy.,Give stat Speed boost (40),90,normal,,

long_shot_o,Long Shot ◎,stat_speed.png,Upgraded,Increase performance when 4th favorite or below.,Give stat Speed boost (60),,upgrade,long_shot,110
long_shot,Long Shot ○,stat_speed.png,Normal,Moderately increase performance when 4th favorite or below.,Give stat Speed boost (40),90,normal,,

sympathy,Sympathy,stat_speed.png,Normal,Moderately increase performance when many runners share a sympathetic heart.,Give stat Speed boost (40),90,normal,,
lone_wolf,Lone Wolf,stat_speed.png,Normal,Moderately increase performance when no other runners have the heart of a lone wolf.,Give stat Speed boost (40),90,normal,,

tokyo_racecourse_o,Tokyo Racecourse ◎,stat_stamina.png,Upgraded,Increase performance at Tokyo Racecourse.,Give stat Stamina boost (60),,upgrade,tokyo_racecourse,110
tokyo_racecourse,Tokyo Racecourse ○,stat_stamina.png,Normal,Moderately increase performance at Tokyo Racecourse.,Give stat Stamina boost (40),90,normal,,

nakayama_racecourse_o,Nakayama Racecourse ◎,stat_stamina.png,Upgraded,Increase performance at Nakayama Racecourse.,Give stat Stamina boost (60),,upgrade,nakayama_racecourse,110
nakayama_racecourse,Nakayama Racecourse ○,stat_stamina.png,Normal,Moderately increase performance at Nakayama Racecourse.,Give stat Stamina boost (40),90,normal,,

hanshin_racecourse_o,Hanshin Racecourse ◎,stat_stamina.png,Upgraded,Increase performance at Hanshin Racecourse.,Give stat Stamina boost (60),,upgrade,hanshin_racecourse,110
hanshin_racecourse,Hanshin Racecourse ○,stat_stamina.png,Normal,Moderately increase performance at Hanshin Racecourse.,Give stat Stamina boost (40),90,normal,,

kyoto_racecourse_o,Kyoto Racecourse ◎,stat_stamina.png,Upgraded,Increase performance at Kyoto Racecourse.,Give stat Stamina boost (60),,upgrade,kyoto_racecourse,110
kyoto_racecourse,Kyoto Racecourse ○,stat_stamina.png,Normal,Moderately increase performance at Kyoto Racecourse.,Give stat Stamina boost (40),90,normal,,
yodo_invicta,Yodo Invicta,super_stat_stamina.png,Upgraded,"Increase performance at Kyoto Racecourse, boosting Stamina and Wit.",Give stat Stamina boost (60) and Wit boost (60),,upgrade,kyoto_racecourse,130

chukyo_racecourse_o,Chukyo Racecourse ◎,stat_stamina.png,Upgraded,Increase performance at Chukyo Racecourse.,Give stat Stamina boost (60),,upgrade,chukyo_racecourse,110
chukyo_racecourse,Chukyo Racecourse ○,stat_stamina.png,Normal,Moderately increase performance at Chukyo Racecourse.,Give stat Stamina boost (40),90,normal,,

sapporo_racecourse_o,Sapporo Racecourse ◎,stat_stamina.png,Upgraded,Increase performance at Sapporo Racecourse.,Give stat Stamina boost (60),,upgrade,sapporo_racecourse,110
sapporo_racecourse,Sapporo Racecourse ○,stat_stamina.png,Normal,Moderately increase performance at Sapporo Racecourse.,Give stat Stamina boost (40),90,normal,,

hakodate_racecourse_o,Hakodate Racecourse ◎,stat_stamina.png,Upgraded,Increase performance at Hakodate Racecourse.,Give stat Stamina boost (60),,upgrade,hakodate_racecourse,110
hakodate_racecourse,Hakodate Racecourse ○,stat_stamina.png,Normal,Moderately increase performance at Hakodate Racecourse.,Give stat Stamina boost (40),90,normal,,

fukushima_racecourse_o,Fukushima Racecourse ◎,stat_stamina.png,Upgraded,Increase performance at Fukushima Racecourse.,Give stat Stamina boost (60),,upgrade,fukushima_racecourse,110
fukushima_racecourse,Fukushima Racecourse ○,stat_stamina.png,Normal,Moderately increase performance at Fukushima Racecourse.,Give stat Stamina boost (40),90,normal,,

niigata_racecourse_o,Niigata Racecourse ◎,stat_stamina.png,Upgraded,Increase performance at Niigata Racecourse.,Give stat Stamina boost (60),,upgrade,niigata_racecourse,110
niigata_racecourse,Niigata Racecourse ○,stat_stamina.png,Normal,Moderately increase performance at Niigata Racecourse.,Give stat Stamina boost (40),90,normal,,

kokura_racecourse_o,Kokura Racecourse ◎,stat_stamina.png,Upgraded,Increase performance at Kokura Racecourse.,Give stat Stamina boost (60),,upgrade,kokura_racecourse,110
kokura_racecourse,Kokura Racecourse ○,stat_stamina.png,Normal,Moderately increase performance at Kokura Racecourse.,Give stat Stamina boost (40),90,normal,,

standard_distance_o,Standard Distance ◎,stat_stamina.png,Upgraded,Increase performance over standard distances (multiples of 400m).,Give stat Stamina boost (60),,upgrade,standard_distance,110
standard_distance,Standard Distance ○,stat_stamina.png,Normal,Moderately increase performance over standard distances (multiples of 400m).,Give stat Stamina boost (40),90,normal,,

non_standard_distance_o,Non-Standard Distance ◎,stat_stamina.png,Upgraded,Increase performance over non-standard distances (non-multiples of 400m).,Give stat Stamina boost (60),,upgrade,non_standard_distance,110
non_standard_distance,Non-Standard Distance ○,stat_stamina.png,Normal,Moderately increase performance over non-standard distances (non-multiples of 400m).,Give stat Stamina boost (40),90,normal,,

oi_racecourse_o,Oi Racecourse ◎,stat_stamina.png,Upgraded,Increase performance at Oi Racecourse.,Give stat Stamina boost (60),,upgrade,oi_racecourse,110
oi_racecourse,Oi Racecourse ○,stat_stamina.png,Normal,Moderately increase performance at Oi Racecourse.,Give stat Stamina boost (40),90,normal,,

firm_conditions_o,Firm Conditions ◎,stat_power.png,Upgraded,Increase performance on firm ground.,Give stat Power boost (60),,upgrade,firm_conditions,110
firm_conditions,Firm Conditions ○,stat_power.png,Normal,Moderately increase performance on firm ground.,Give stat Power boost (40),90,normal,,
firm_course_menace,Firm Course Menace,super_stat_power.png,Upgraded,"Increase performance on firm ground, boosting Power and Speed.",Give stat Power boost (60) and Speed boost (60),,upgrade,firm_conditions,130

wet_conditions_o,Wet Conditions ◎,stat_power.png,Upgraded,"Increase performance on good, soft, and heavy ground.",Give stat Power boost (60),,upgrade,wet_conditions,110
wet_conditions,Wet Conditions ○,stat_power.png,Normal,"Moderately increase performance on good, soft, and heavy ground.",Give stat Power boost (40),90,normal,,

competitive_spirit_o,Competitive Spirit ◎,stat_power.png,Upgraded,Increase performance when many other runners are using the same strategy.,Give stat Power boost (60),,upgrade,competitive_spirit,110
competitive_spirit,Competitive Spirit ○,stat_power.png,Normal,Moderately increase performance when many other runners are using the same strategy.,Give stat Power boost (40),90,normal,,

sunny_days_o,Sunny Days ◎,stat_guts.png,Upgraded,Increase performance in sunny weather.,Give stat Guts boost (60),,upgrade,sunny_days,110
sunny_days,Sunny Days ○,stat_guts.png,Normal,Moderately increase performance in sunny weather.,Give stat Guts boost (40),90,normal,,

cloudy_days_o,Cloudy Days ◎,stat_guts.png,Upgraded,Increase performance in cloudy weather.,Give stat Guts boost (60),,upgrade,cloudy_days,110
cloudy_days,Cloudy Days ○,stat_guts.png,Normal,Moderately increase performance in cloudy weather.,Give stat Guts boost (40),90,normal,,

rainy_days_o,Rainy Days ◎,stat_guts.png,Upgraded,Increase performance in rainy weather.,Give stat Guts boost (60),,upgrade,rainy_days,110
rainy_days,Rainy Days ○,stat_guts.png,Normal,Moderately increase performance in rainy weather.,Give stat Guts boost (40),90,normal,,

snowy_days_o,Snowy Days ◎,stat_guts.png,Upgraded,Increase performance in snowy weather.,Give stat Guts boost (60),,upgrade,snowy_days,110
snowy_days,Snowy Days ○,stat_guts.png,Normal,Moderately increase performance in snowy weather.,Give stat Guts boost (40),90,normal,,

target_in_sight_o,Target in Sight ◎,stat_guts.png,Upgraded,Increase performance when the favorite is using the same strategy.,Give stat Guts boost (60),,upgrade,target_in_sight,110
target_in_sight,Target in Sight ○,stat_guts.png,Normal,Moderately increase performance when the favorite is using the same strategy.,Give stat Guts boost (40),90,normal,,

inner_post_proficiency_o,Inner Post Proficiency ◎,stat_wit.png,Upgraded,Increase performance in brackets 1-3.,Give stat Wit boost (60),,upgrade,inner_post_proficiency,110
inner_post_proficiency,Inner Post Proficiency ○,stat_wit.png,Normal,Moderately increase performance in brackets 1-3.,Give stat Wit boost (40),90,normal,,

front_runner_savvy_o,Front Runner Savvy ◎,stat_wit.png,Upgraded,Increase ability to get into a good position. (Front Runner),Give stat Wit boost (60),,upgrade,front_runner_savvy,110
front_runner_savvy,Front Runner Savvy ○,stat_wit.png,Normal,Moderately increase ability to get into a good position. (Front Runner),Give stat Wit boost (40),90,normal,,

pace_chaser_savvy_o,Pace Chaser Savvy ◎,stat_wit.png,Upgraded,Increase ability to get into a good position. (Pace Chaser),Give stat Wit boost (60),,upgrade,pace_chaser_savvy,110
pace_chaser_savvy,Pace Chaser Savvy ○,stat_wit.png,Normal,Moderately increase ability to get into a good position. (Pace Chaser),Give stat Wit boost (40),90,normal,,

late_surger_savvy_o,Late Surger Savvy ◎,stat_wit.png,Upgraded,Increase ability to get into a good position. (Late Surger),Give stat Wit boost (60),,upgrade,late_surger_savvy,110
late_surger_savvy,Late Surger Savvy ○,stat_wit.png,Normal,Moderately increase ability to get into a good position. (Late Surger),Give stat Wit boost (40),90,normal,,

end_closer_savvy_o,End Closer Savvy ◎,stat_wit.png,Upgraded,Increase ability to get into a good position. (End Closer),Give stat Wit boost (60),,upgrade,end_closer_savvy,110
end_closer_savvy,End Closer Savvy ○,stat_wit.png,Normal,Moderately increase ability to get into a good position. (End Closer),Give stat Wit boost (40),90,normal,,
towards_the_scenery_i_seek,Towards the Scenery I Seek,stat_speed.png,Normal,Moderately increase performance in pursuit of that long sought-after scenery.,Give stat Speed boost (40),,normal,,,,
show_me_what_lies_beyond,Show Me What Lies Beyond!,stat_speed.png,Normal,Moderately increase Silence Suzuka's performance thanks to the desire to see her running reach new heights.,Give stat Speed boost (40),,normal,,,,
chin_up_derby_umamusume,"Chin Up, Derby Umamusume!",stat_speed.png,Normal,"Feel closer to being Japan's top racer, moderately increasing performance.",Give stat Speed boost (40),,normal,,,,
unchanging,Unchanging,super_stat_speed.png,Upgraded,Greatly increase performance with the same ambition of days past.,Give stat Speed boost (80),,normal,,,,
unquenched_thirst,Unquenched Thirst,stat_stamina.png,Normal,Moderately increase performance with the desire to race.,Give stat Stamina boost (40),,normal,,,,
hoiya_have_a_good_run,Hoiya! Have a Good Run!,stat_stamina.png,Normal,Moderately increase Silence Suzuka's performance thanks to a charm that guarantees a satisfying run.,Give stat Stamina boost (40),,normal,,,,
long_race_enthusiast,Long Race Enthusiast,stat_stamina.png,Normal,Increase performance in Long Turf races. This skill is exclusive to the event.,Give stat Stamina boost (60),,normal,,,,
for_the_team,For the Team,super_stat_stamina.png,Upgraded,"The whole team feels super determined to win this special race, greatly increasing performance.",Give stat Stamina boost (80),,normal,,,,
as_a_friend_and_rival,As a Friend and Rival,stat_power.png,Normal,Moderately increase Silence Suzuka's performance through the happiness felt seeing a friend find their running style.,Give stat Power boost (40),,normal,,,,
mile_race_enthusiast,Mile Race Enthusiast,stat_power.png,Normal,Increase performance in Mile Turf races. This skill is exclusive to the event.,Give stat Power boost (60),,normal,,,,
restraint,Restraint,stat_wit.png,Normal,Increase Wit and moderately decrease the chance of being Rushed.,Give stat Wit boost (60) and Decreased Rush Chance (-3),160,normal,,,,
medium_race_enthusiast,Medium Race Enthusiast,stat_wit.png,Normal,Increase performance in Medium Turf races. This skill is exclusive to the event.,Give stat Wit boost (60),,normal,,,,
lucky_seven,Lucky Seven,lucky7.png,Normal,Moderately good things may happen when in bracket 7.,Give stat Speed boost (40) and Stamina boost (40) and Power boost (40).,110,normal,,
super_lucky_seven,Super Lucky Seven,super_lucky7.png,Upgraded,Good things may happen when in bracket 7.,Give stat Speed boost (60) and Stamina boost (60) and Power boost (60).,,upgrade,lucky_seven,110

right_handed_bad,Right-Handed ×,negative_speed.png,Negative,Moderately decrease performance on right-handed tracks.,Give stat Speed Down (-40),,negative,,50,negative
left_handed_bad,Left-Handed ×,negative_speed.png,Negative,Moderately decrease performance on left-handed tracks.,Give stat Speed Down (-40),,negative,,50,negative
spring_runner_bad,Spring Runner ×,negative_speed.png,Negative,Moderately decrease performance in spring.,Give stat Speed Down (-40),,negative,,50,negative
summer_runner_bad,Summer Runner ×,negative_speed.png,Negative,Moderately decrease performance in summer.,Give stat Speed Down (-40),,negative,,50,negative
fall_runner_bad,Fall Runner ×,negative_speed.png,Negative,Moderately decrease performance in fall.,Give stat Speed Down (-40),,negative,,50,negative
winter_runner_bad,Winter Runner ×,negative_speed.png,Negative,Moderately decrease performance in winter.,Give stat Speed Down (-40),,negative,,50,negative
outer_post_averseness,Outer Post Averseness,negative_speed.png,Negative,Moderately decrease performance in brackets 6-8.,Give stat Speed Down (-40),,negative,,50,negative
g1_averseness,G1 Averseness,negative_speed.png,Negative,Moderately decrease performance in G1 or otherwise important races.,Give stat Speed Down (-40),,negative,,50,negative
heart_3d_nail_art,♡ 3D Nail Art,negative_speed.png,Negative,Moderately decrease performance on firm ground.,Give stat Speed Down (-40),,negative,,50,negative
creeping_anxiety,Creeping Anxiety,negative_speed.png,Negative,Moderately decrease performance due to Trainer's anxiety.,Give stat Speed Down (-40),,negative,,50,negative
corner_recovery_bad,Corner Recovery ×,negative_recovery.png,Negative,Moderately lose endurance on a corner with inefficient turning.,Stamina Drain (-0.02),100,normal,,,negative
ramp_revulsion,Ramp Revulsion,negative_recovery.png,Negative,Moderately increase fatigue on an uphill.,Stamina Drain (-0.02),100,normal,,,negative
packphobia,Packphobia,negative_recovery.png,Negative,Moderately lose endurance when surrounded.,Stamina Drain (-0.02),100,normal,,,negative

tokyo_racecourse_bad,Tokyo Racecourse ×,negative_stamina.png,Negative,Moderately decrease performance at Tokyo Racecourse.,Give stat Stamina Down (-40),,normal,,50,negative
nakayama_racecourse_bad,Nakayama Racecourse ×,negative_stamina.png,Negative,Moderately decrease performance at Nakayama Racecourse.,Give stat Stamina Down (-40),,normal,,50,negative
hanshin_racecourse_bad,Hanshin Racecourse ×,negative_stamina.png,Negative,Moderately decrease performance at Hanshin Racecourse.,Give stat Stamina Down (-40),,normal,,50,negative
kyoto_racecourse_bad,Kyoto Racecourse ×,negative_stamina.png,Negative,Moderately decrease performance at Kyoto Racecourse.,Give stat Stamina Down (-40),,normal,,50,negative
chukyo_racecourse_bad,Chukyo Racecourse ×,negative_stamina.png,Negative,Moderately decrease performance at Chukyo Racecourse.,Give stat Stamina Down (-40),,normal,,50,negative
sapporo_racecourse_bad,Sapporo Racecourse ×,negative_stamina.png,Negative,Moderately decrease performance at Sapporo Racecourse.,Give stat Stamina Down (-40),,normal,,40,negative
hakodate_racecourse_bad,Hakodate Racecourse ×,negative_stamina.png,Negative,Moderately decrease performance at Hakodate Racecourse.,Give stat Stamina Down (-40),,normal,,40,negative
fukushima_racecourse_bad,Fukushima Racecourse ×,negative_stamina.png,Negative,Moderately decrease performance at Fukushima Racecourse.,Give stat Stamina Down (-40),,normal,,40,negative
niigata_racecourse_bad,Niigata Racecourse ×,negative_stamina.png,Negative,Moderately decrease performance at Niigata Racecourse.,Give stat Stamina Down (-40),,normal,,40,negative
kokura_racecourse_bad,Kokura Racecourse ×,negative_stamina.png,Negative,Moderately decrease performance at Kokura Racecourse.,Give stat Stamina Down (-40),,normal,,40,negative
standard_distance_bad,Standard Distance ×,negative_stamina.png,Negative,Moderately decrease performance over standard distances (multiples of 400m).,Give stat Stamina Down (-40),,normal,,50,negative
non_standard_distance_bad,Non-Standard Distance ×,negative_stamina.png,Negative,Moderately decrease performance over non-standard distances (non-multiples of 400m).,Give stat Stamina Down (-40),,normal,,50,negative
paddock_fright,Paddock Fright,negative_stamina.png,Negative,Moderately decrease performance when the favorite.,Give stat Stamina Down (-40),,normal,,50,negative
oi_racecourse_bad,Oi Racecourse ×,negative_stamina.png,Negative,Moderately decrease performance at Oi Racecourse.,Give stat Stamina Down (-40),,normal,,50,negative

firm_conditions_bad,Firm Conditions ×,negative_power.png,Negative,Moderately decrease performance on firm ground.,Give stat Power Down (-40),,normal,,50,negative
wet_conditions_bad,Wet Conditions ×,negative_power.png,Negative,"Moderately decrease performance on good, soft, and heavy ground.",Give stat Power Down (-40),,normal,,50,negative
wallflower,Wallflower,negative_power.png,Negative,Moderately decrease performance when many other runners are using the same strategy.,Give stat Power Down (-40),,normal,,50,negative
rainy_days_bad,Rainy Days ×,negative_guts.png,Negative,Moderately decrease performance in rainy weather.,Give stat Guts Down (-40),,normal,,50,negative
ninety_nine_problems,99 Problems,negative_guts.png,Negative,"Get overwhelmed by powerful opponents, moderately decreasing Guts and Wit.",Give stat Guts Down (-40) and Wit Down (-40),,normal,,0,negative
inner_post_averseness,Inner Post Averseness,negative_wit.png,Negative,Moderately decrease performance in brackets 1-3.,Give stat Wit Down (-40),,normal,,50,negative

swinging_maestro,Swinging Maestro,super_recovery_stamina.png,Upgraded,Recover endurance on a corner with efficient turning [Skills will be activated on a random corner].,Stamina recovery (0.055),,upgrade,corner_recovery,170,recovery
corner_recovery,Corner Recovery,recovery_stamina.png,Normal,Slightly recover endurance on a corner with efficient turning [Skills will be activated on a random corner].,Stamina recovery (0.015),170,normal,,,recovery
breath_of_fresh_air,Breath of Fresh Air,super_recovery_stamina.png,Upgraded,Recover endurance on a straight [Skills will be activated on a random straight].,Stamina recovery (0.055),,upgrade,straightaway_recovery,170,recovery
straightaway_recovery,Straightaway Recovery,recovery_stamina.png,Normal,Slightly recover endurance on a straight [Skills will be activated on a random straight].,Stamina recovery (0.015),170,normal,,,recovery
iron_will,Iron Will,super_recovery_stamina.png,Upgraded,Recover endurance when the way ahead is jammed early-race or mid-race [Skills will be activated when being blocked ahead for 1s in early race or mid race].,Stamina recovery (0.055),,upgrade,lay_low,160,recovery
lay_low,Lay Low,recovery_stamina.png,Normal,Slightly recover endurance when the way ahead is jammed early-race or mid-race [Skills will be activated when being blocked ahead for 1s in early race or mid race].,Stamina recovery (0.015),160,normal,,,recovery
indomitable,Indomitable,super_recovery_stamina.png,Upgraded,Recover endurance when passed by another runner mid-race.,Stamina recovery (0.055),,upgrade,pace_strategy,170,recovery
pace_strategy,Pace Strategy,recovery_stamina.png,Normal,Slightly recover endurance when passed by another runner mid-race.,Stamina recovery (0.015),170,normal,,,recovery
unruffled,Unruffled,super_recovery_stamina.png,Upgraded,Recover endurance when surrounded mid-race.,Stamina recovery (0.055),,upgrade,calm_in_a_crowd,170,recovery
calm_in_a_crowd,Calm in a Crowd,recovery_stamina.png,Normal,Slightly recover endurance when surrounded mid-race.,Stamina recovery (0.015),170,normal,,,recovery

calm_and_collected,Calm and Collected,super_recovery_stamina.png,Upgraded,Decrease fatigue upon approaching mid-race [Activate when you are in 5th pos in CM and 6th pos in LoH or higher in a random point before going to mid race]. (Pace Chaser),Stamina recovery (0.055),,upgrade,stamina_to_spare,180,recovery
stamina_to_spare,Stamina to Spare,recovery_stamina.png,Normal,Slightly decrease fatigue upon approaching mid-race [Activate when you are in the 5th pos or higher in a random point before going to mid-race]. (Pace Chaser),Stamina recovery (0.015),180,normal,,,recovery
race_planner,Race Planner,super_recovery_stamina.png,Upgraded,Decrease fatigue mid-race [Activate when you are in 5th pos in CM anh 6th in LoH or higher in a random point of mid-race]. (Pace Chaser),Stamina recovery (0.055),,upgrade,preferred_position,180,recovery
preferred_position,Preferred Position,recovery_stamina.png,Normal,Slightly decrease fatigue mid-race [Activate when you are in 5th pos in CM anh 6th in LoH or higher in a random point of mid-race]. (Pace Chaser),Stamina recovery (0.015),180,normal,,,recovery
sleeping_lion,Sleeping Lion,super_recovery_stamina.png,Upgraded,Decrease fatigue mid-race [Activate when the distance between your uma and the 1st uma is >= 75m]. (End Closer),Stamina recovery (0.055),,upgrade,standing_by,180,recovery
standing_by,Standing By,recovery_stamina.png,Normal,Slightly decrease fatigue mid-race [Activate when the distance between your uma and the 1st uma is >= 75m]. (End Closer),Stamina recovery (0.015),180,normal,,,recovery
wait_and_see,Wait-and-See,recovery_stamina.png,Normal,Slightly decrease fatigue and very slightly increase acceleration when positioned toward the back mid-race. (Sprint),Stamina recovery (0.015) and Acceleration boost (0.1),160,normal,,,recovery
keen_eye,Keen Eye,super_recovery_stamina.png,Upgraded,"Decrease fatigue, then moderately decrease velocity of runners ahead when positioned toward the back upon approaching mid-race. [Activate when your uma is 6th pos in CM and 7th in LoH or worse at a random point in latter early-race] (Mile)",Stamina recovery (0.055) and Decrease current Speed (-0.2),,upgrade,watchful_eye,160,recovery
watchful_eye,Watchful Eye,recovery_stamina.png,Normal,"Slightly decrease fatigue, then very slightly decrease velocity of runners ahead when positioned toward the back upon approaching mid-race. [Activate when your uma is 6th pos or worse at a random point in latter early-race] (Mile)",Stamina recovery (0.015) and Decrease current Speed (-0.05),160,normal,,,recovery
