id,name,icon,rarity,description,effect,skill_points,type,parent_id,required_sp,category,base_duration
burning_soul,Burning Soul,super_speed_skill.png,Upgraded,"When engaged in a challenge midpack mid-race, moderately recover endurance and moderately increase velocity. (Medium)",Increase target speed (0.25),,upgrade,fighting_spirit,160,buff,1.8s
eager,Eager,speed_skill.png,Normal,"When positioned toward the back mid-race, slightly increase velocity. (Medium)",Increase target speed (0.15),160,normal,,,buff,2.4s
elated,Elated,super_speed_skill.png,Upgraded,"When positioned toward the back mid-race, increase velocity. (Medium)",Increase target speed (0.35),,upgrade,eager,160,buff,2.4s
pumped,Pumped,speed_skill.png,Normal,"When positioned toward the back on the final corner, slightly increase velocity. (Mile)",Increase target speed (0.15),160,normal,,,buff,1.8s
full_of_vigor,Full of Vigor,super_speed_skill.png,Upgraded,"When positioned toward the back on the final corner, increase velocity. (Mile)",Increase target speed (0.35),,upgrade,pumped,160,buff,1.8s
fearless,Fearless,speed_skill.png,Normal,"When positioned in the midpack during the second half of the race, slightly increase velocity and very minimally increase acceleration. (Late Surger)",Increase target speed (0.15),180,normal,,,buff,1.8s
dauntless,Dauntless,super_speed_skill.png,Upgraded,"When positioned in the midpack during the second half of the race, increase velocity and very slightly increase acceleration. (Late Surger)",Increase target speed (0.35),,upgrade,fearless,180,buff,1.8s
with_all_my_soul,With All My Soul,speed_skill.png,Normal,"When positioned toward the front mid-race, slightly increase velocity and minimally decrease the velocity of runners behind the user. (Medium)",Increase target speed (0.15) and Decrease Speed (-0.035),160,normal,,,buff,1.8s
wild_wind,Wild Wind,super_speed_skill.png,Upgraded,"When positioned toward the front mid-race, increase velocity and slightly decrease the velocity of runners behind the user. (Medium)",Increase target speed (0.35) and Decrease Speed (-0.15),,upgrade,with_all_my_soul,160,buff,1.8s
full_throttle,Full Throttle,speed_skill.png,Normal,Greatly consume endurance mid-race and moderately increase velocity. (Late Surger),Increase target speed (0.25),160,normal,,,buff,2.4s
keep_going,Keep Going!,super_speed_skill.png,Upgraded,Greatly consume endurance mid-race and greatly increase velocity. (Late Surger),Increase target speed (0.45),,upgrade,full_throttle,160,buff,2.4s
downhill_speedster,Downhill Speedster,speed_skill.png,Normal,Slightly increase velocity on downhills.,Increase target speed (0.15),170,normal,,,buff,2.4s
professor_of_curvature,Professor of Curvature,super_speed_skill.png,Upgraded,Increase velocity on a corner with skilled turning.,Increase target speed (0.35),,upgrade,corner_adept,180,buff,2.4s
beeline_burst,Beeline Burst,super_speed_skill.png,Upgraded,Increase velocity on a straight.,Increase target speed (0.35),,upgrade,straightaway_adept,170,buff,2.4s
it_s_on,It's On!,super_speed_skill.png,Upgraded,Increase velocity when passing another runner mid-race.,Increase target speed (0.35),,upgrade,ramp_up,170,buff,1.8s
in_body_and_mind,In Body and Mind,super_speed_skill.png,Upgraded,Increase velocity in the last spurt.,Increase target speed (0.35),,upgrade,homestretch_haste,170,buff,2.4s
escape_artist,Escape Artist,super_speed_skill.png,Upgraded,Increase ability to go to the front mid-race. (Front Runner),Increase target speed (0.35),,upgrade,fast_paced,180,buff,3s
speed_star,Speed Star,super_speed_skill.png,Upgraded,Increase ability to break out of the pack on the final corner. (Pace Chaser),Increase target speed (0.35),,upgrade,prepared_to_pass,180,buff,1.8s
fast_furious,Fast & Furious,super_speed_skill.png,Upgraded,Increase velocity mid-race. (Late Surger),Increase target speed (0.35),,upgrade,position_pilfer,180,buff,2.4s
rising_dragon,Rising Dragon,super_speed_skill.png,Upgraded,Increase velocity when passing another runner on the outside on the final corner. (Late Surger),Increase target speed (0.35),,upgrade,outer_swell,180,buff,3s
sturm_und_drang,Sturm und Drang,super_speed_skill.png,Upgraded,Move up in preparation to close the gap when positioned toward the back late-race. (End Closer),Increase target speed (0.35),,upgrade,masterful_gambit,180,buff,3s
blinding_flash,Blinding Flash,super_speed_skill.png,Upgraded,Increase spurting ability when positioned toward the back late-race. (Sprint),Increase target speed (0.35),,upgrade,gap_closer,160,buff,3s
mile_maven,Mile Maven,super_speed_skill.png,Upgraded,Widen the margin when positioned toward the front early-race. (Mile),Increase target speed (0.35),,upgrade,productive_plan,160,buff,3s
killer_tunes,Killer Tunes,super_speed_skill.png,Upgraded,Increase positioning ability when positioned toward the front mid-race. (Medium),Increase target speed (0.35),,upgrade,up_tempo,160,buff,2.4s
unyielding,Unyielding,super_speed_skill.png,Upgraded,Increase ability to fight back when passed by another runner on the final corner. (Medium),Increase target speed (0.35),,upgrade,steadfast,160,buff,3s
innate_experience,Innate Experience,super_speed_skill.png,Upgraded,Increase velocity when near the inner rail on the final corner. (Long),Increase target speed (0.35),,upgrade,inside_scoop,160,buff,3s
staggering_lead,Staggering Lead,super_speed_skill.png,Upgraded,Increase ability to maintain the lead when leading by a large margin mid-race. (Sprint),Increase target speed (0.35),,upgrade,huge_lead,170,buff,3s
changing_gears,Changing Gears,super_speed_skill.png,Upgraded,Increase passing ability when positioned toward the front mid-race. (Mile),Increase target speed (0.35),,upgrade,shifting_gears,160,buff,2.4s
big_sisterly,Big-Sisterly,super_speed_skill.png,Upgraded,Increase passing ability. (Mile),Increase target speed (0.35),,upgrade,unyielding_spirit,120,buff,2.4s
vanguard_spirit,Vanguard Spirit,super_speed_skill.png,Upgraded,Increase ability to maintain the lead when leading by a fair margin mid-race. (Long),Increase target speed (0.35),,upgrade,keeping_the_lead,160,buff,3s
overwhelming_pressure,Overwhelming Pressure,super_speed_skill.png,Upgraded,Increase velocity when passing another runner late-race. (Long),Increase target speed (0.35),,upgrade,pressure,160,buff,3s
dream_run,Dream Run,super_speed_skill.png,Special (Event only),Increase velocity on the final straight due to a strong desire to cross the finish line carrying everyone's hopes and dreams.,Increase target speed (0.35),,normal,,,buff,5s
flash_forward,Flash Forward,super_speed_skill.png,Upgraded,Increase velocity on a straight. (Medium),Increase target speed (0.35),,upgrade,medium_straightaways,150,buff,3s
blast_forward,Blast Forward,super_speed_skill.png,Upgraded,Increase velocity on a straight. (Long),Increase target speed (0.35),,upgrade,long_straightaways,150,buff,3s
refraction_arc,Refraction Arc,super_speed_skill.png,Upgraded,Increase velocity on corners. (Medium),Increase target speed (0.35),,upgrade,medium_corners,150,buff,3s
certain_victory,Certain Victory,speed_unique_skill.png,Unique,Greatly increase velocity with an indomitable fighting spirit on the final straight after being on the heels of another runner toward the front on the final corner or later.,Increase target speed (0.45),,normal,,,unique,5s
legacy_of_the_strong,Legacy of the Strong,unique_skill.png,Unique,Increase velocity continuously when pressured by another runner and running out of energy toward the front on the final corner or later.,Increase target speed (0.35),,normal,,,unique,6s
warning_shot,Warning Shot!,unique_skill.png,Unique,Slightly increase velocity with a long spurt starting halfway through the race.,Increase target speed (0.15),,normal,,,unique,6s
xceleration,Xceleration,unique_skill.png,Unique,Become stronger at challenging rivals and moderately increase velocity when positioned toward the front with 200m or less remaining.,Increase target speed (0.25),,normal,,,unique,5s
red_ace,Red Ace,unique_skill.png,Unique,Slightly swell with the determination to be number one when positioned toward the front in the second half of the race.,Increase target speed (0.15),,normal,,,unique,5s
focused_mind,Focused Mind,unique_skill.png,Unique,Moderately increase velocity with a strong turn of foot when passing another runner toward the back on the final straight.,Increase target speed (0.25),,normal,,,unique,5s
corazon_ardiente,Corazón ☆ Ardiente,unique_skill.png,Unique,Slightly hang on to the advantage when positioned toward the front with energy to spare on the final straight.,Increase target speed (0.15),,normal,,,unique,5s
empress_s_pride,Empress's Pride,unique_skill.png,Unique,Moderately increase velocity with the stride of an empress when passing another runner from midpack or further back on the final corner.,Increase target speed (0.25),,normal,,,unique,5s
1st_place_kiss,1st Place Kiss☆,unique_skill.png,Unique,Slightly increase ability to break out of the pack on the straight after engaging in a challenge toward the front on the final corner or later.,Increase target speed (0.15),,normal,,,unique,5s
v_is_for_victory,V Is for Victory!,unique_skill.png,Unique,Moderately increase velocity with winning ambition when positioned toward the front on the final straight after engaging in a challenge on the final corner or later.,Increase target speed (0.25),,normal,,,unique,5s
class_rep_speed_bakushin,Class Rep + Speed = Bakushin,unique_skill.png,Unique,Moderately increase velocity with BAKUSHIN power when engaged in a challenge toward the front in the second half of the race.,Increase target speed (0.25),,normal,,,unique,5s
luck_be_with_me,Luck Be with Me!,unique_skill.png,Unique,Moderately clear a path forward with the power of divination when the way ahead is jammed late-race.,Increase target speed (0.25),,normal,,,unique,5s
i_can_win_sometimes_right,"I Can Win Sometimes, Right?",unique_skill.png,Unique,Moderately increase velocity with an arousal of fighting spirit when positioned 3rd and about to lose late-race.,Increase target speed (0.25),,normal,,,unique,5s
call_me_king,Call Me King,unique_skill.png,Unique,Increase velocity in a true display of skill with 200m remaining after racing calmly.,Increase target speed (0.35),,normal,,,unique,5s
shooting_star,Shooting Star,unique_skill.png,Unique,Ride the momentum to increase velocity and very slightly increase acceleration after passing another runner toward the front late-race.,Increase target speed (0.35),,normal,,,unique,5s
the_view_from_the_lead_is_mine,The View from the Lead Is Mine!,unique_skill.png,Unique,Increase velocity by drawing on all remaining strength when in the lead by a fair margin in the second half of the race.,Increase target speed (0.35),,normal,,,unique,5s
sky_high_teio_step,Sky-High Teio Step,unique_skill.png,Unique,Greatly increase velocity with flashy footwork when closing the gap to runners ahead on the final straight.,Increase target speed (0.45),,normal,,,unique,5s
triumphant_pulse,Triumphant Pulse,unique_skill.png,Unique,Greatly increase ability to break out of the pack by opening up a path when positioned toward the front with 200m remaining.,Increase target speed (0.45),,normal,,,unique,5s
anchors_aweigh,Anchors Aweigh!,unique_skill.png,Unique,Moderately increase velocity steadily with a long spurt starting halfway through the race.,Increase target speed (0.25),,normal,,,unique,6s
cut_and_drive,Cut and Drive!,unique_skill.png,Unique,Become stronger at challenging rivals and increase velocity when positioned toward the front with 200m or less remaining.,Increase target speed (0.35),,normal,,,unique,5s
resplendent_red_ace,Resplendent Red Ace,unique_skill.png,Unique,Swell with the determination to be number one when positioned toward the front in the second half of the race.,Increase target speed (0.25),,normal,,,unique,5s
where_there_s_a_will_there_s_a_way,"Where There's a Will, There's a Way",unique_skill.png,Unique,Increase velocity with a strong turn of foot when passing another runner toward the back on the final straight.,Increase target speed (0.35),,normal,,,unique,5s
the_duty_of_dignity_calls,The Duty of Dignity Calls,unique_skill.png,Unique,Increase velocity with the determination to not be overtaken when positioned toward the front on the final corner.,Increase target speed (0.35),,normal,,,unique,5s
victoria_por_plancha,Victoria por plancha ☆,unique_skill.png,Unique,Hang onto the advantage when positioned toward the front with energy to spare on the final straight.,Increase target speed (0.25),,normal,,,unique,5s
this_dance_is_for_vittoria,This Dance Is for Vittoria!,unique_skill.png,Unique,Increase velocity with royal brilliance when positioned toward the front and close to the runner ahead or behind on the final corner or later.,Increase target speed (0.35),,normal,,,unique,5s
behold_thine_emperor_s_divine_might,Behold Thine Emperor's Divine Might,unique_skill.png,Unique,Greatly increase velocity on the final straight after passing another runner 3 times late-race.,Increase target speed (0.45),,normal,,,unique,5s
blazing_pride,Blazing Pride,unique_skill.png,Unique,Increase velocity with the stride of an empress when passing another runner from midpack or further back on the final corner.,Increase target speed (0.35),,normal,,,unique,5s
win_q_e_d,∴win Q.E.D.,unique_skill.png,Unique,Increase velocity by deriving the winning equation when passing another runner toward the front on the final corner or later.,Increase target speed (0.35),,normal,,,unique,5s
flashylanding,Flashy☆Landing,unique_skill.png,Unique,Increase ability to break out of the pack on the straight after engaging in a challenge toward the front on the final corner or later.,Increase target speed (0.25),,normal,,,unique,5s
g00_1st_f,G00 1st. F∞;,unique_skill.png,Unique,Increase velocity when positioned toward the front after making it to the final straight without faltering.,Increase target speed (0.35),,normal,,,unique,5s
blue_rose_closer,Blue Rose Closer,unique_skill.png,Unique,Increase velocity with strong willpower on the final straight after passing another runner in the front part of the pack on the final corner or later.,Increase target speed (0.35),,normal,,,unique,5s
our_ticket_to_win,Our Ticket to Win!,unique_skill.png,Unique,Increase velocity with winning ambition when positioned toward the front on the final straight after engaging in a challenge on the final corner or later.,Increase target speed (0.35),,normal,,,unique,5s
genius_x_bakushin_victory,Genius x Bakushin = Victory,unique_skill.png,Unique,Increase velocity with BAKUSHIN power when engaged in a challenge toward the front in the second half of the race.,Increase target speed (0.35),,normal,,,unique,5s
i_see_victory_in_my_future,I See Victory in My Future!,unique_skill.png,Unique,Clear a path forward with the power of divination when the way ahead is jammed late-race.,Increase target speed (0.35),,normal,,,unique,5s
just_a_little_farther,Just a Little Farther!,unique_skill.png,Unique,Increase velocity with flaring fighting spirit when positioned 3rd and about to lose late-race.,Increase target speed (0.35),,normal,,,unique,5s
prideful_king,Prideful King,unique_skill.png,Unique,Greatly increase velocity in a true display of skill with 200m remaining after racing calmly.,Increase target speed (0.45),,normal,,,unique,5s
lookatcurren,#LookatCurren,unique_skill.png,Unique,Gain momentum and begin to advance when passing another runner while well-positioned around halfway through the race.,Increase target speed (0.25),,normal,,,unique,5s
nemesis,Nemesis,unique_skill.png,Unique,Increase velocity with smoldering ambition when moving up from midpack on the final corner or later.,Increase target speed (0.35),,normal,,,unique,5s
sparklystardom,SPARKLY☆STARDOM,unique_skill.png,Unique,Become empowered to keep the spotlight when positioned toward the front and close to the runner behind on a straight mid-race.,Increase target speed (0.25),,normal,,,unique,5s
shadow_break,Shadow Break,unique_skill.png,Unique,"Increase velocity with beastly strength when passing another runner on the outside on the final corner or later. If the skill user engaged in a challenge mid-race, greatly increase velocity instead.",Increase target speed (0.45),,normal,,,unique,5s
eternal_moments,Eternal Moments,unique_skill.png,Unique,Increase velocity when starting to make a move from a position toward the front mid-race.,Increase target speed (0.35),,normal,,,unique,5s
flowerymaneuver,Flowery☆Maneuver,unique_skill.png,Unique,"Increase velocity when passing another runner toward the front on the final corner. If passing toward the back, increase acceleration instead.",Increase target speed (0.35),,normal,,,unique,5s
you_and_me_one_on_one,You and Me! One-on-One!,unique_skill.png,Unique,Increase velocity on the final straight after passing another runner on the outside toward the back on the final corner or later.,Increase target speed (0.35),,normal,,,unique,5s
lights_of_vaudeville,Lights of Vaudeville,unique_skill.png,Unique,Greatly increase velocity with a dazzling display when just breaking out of the pack toward the front on the final straight.,Increase target speed (0.45),,normal,,,unique,5s
keep_it_real,KEEP IT REAL.,unique_skill.png,Unique,Moderately increase acceleration steadily with a wink when starting to make a move from midpack in the second half of the race.,Increase acceleration (0.3),,normal,,,unique,6s
a_kiss_for_courage,A Kiss for Courage,unique_skill.png,Unique,Increase velocity enthusiastically when positioned toward the front in the second half of the race after recovering endurance with a skill.,Increase target speed (0.35),,normal,,,unique,5s
i_never_goof_up,I Never Goof Up!,unique_skill.png,Unique,Aim for the front with unwavering determination when passing another runner from midpack or further back on a corner late-race.,Increase target speed (0.25),,normal,,,unique,5s
schwarzes_schwert,Schwarzes Schwert,unique_skill.png,Unique,Increase velocity in a dash for the lead after running calmly and according to plan up until the final straight.,Increase target speed (0.35),,normal,,,unique,5s
bountiful_harvest,Bountiful Harvest,unique_skill.png,Unique,Increase velocity with a surge of great fortune when pressured by another runner toward the back in the second half of the race.,Increase target speed (0.35),,normal,,,unique,5s
yummyspeed,YUMMY☆SPEED!,unique_skill.png,Unique,Kick forward hard with renewed vigor when starting to get tired while well-positioned halfway through the race.,Increase target speed (0.25),,normal,,,unique,5s
omg_the_final_sprint,OMG! (ﾟ∀ﾟ) The Final Sprint! ☆,unique_skill.png,Unique,Increase velocity and navigation with the pure euphoria of being within breathing distance of precious waifus after passing another runner 2 times late-race.,Increase target speed (0.35),,normal,,,unique,5s
give_mummy_a_hug,Give Mummy a Hug ♡,unique_skill.png,Unique,Increase ability to break out of the pack when well-positioned and close to the runner ahead on the final straight.,Increase target speed (0.25),,normal,,,unique,5s
a_princess_must_seize_victory,A Princess Must Seize Victory!,unique_skill.png,Unique,Increase velocity with pretty princess power when engaged in a challenge on the final straight.,Increase target speed (0.35),,normal,,,unique,5s
chasing_after_you,Chasing After You,unique_skill.png,Unique,"Chase after an unseen friend when in midpack in the second half of the race, moderately increasing velocity steadily and very slightly intimidating runners ahead.",Increase target speed (0.25),,normal,,,unique,6s
arrows_whistle_shadows_disperse,"Arrows Whistle, Shadows Disperse",unique_skill.png,Unique,Increase velocity with a blazing spirit when pressured by another runner in the front part of the pack on the final corner or later.,Increase target speed (0.35),,normal,,,unique,5s
dancing_in_the_leaves,Dancing in the Leaves,unique_skill.png,Unique,Increase ability to break out of the pack when engaged in a challenge in midpack on the final corner.,Increase target speed (0.25),,normal,,,unique,5s
pop_polish,Pop & Polish,unique_skill.png,Unique,Get hyped and increase velocity when pressured by or passing another runner while well-positioned on the final straight.,Increase target speed (0.35),,normal,,,unique,5s
festive_miracle,Festive Miracle,unique_skill.png,Unique,Control breathing and kick forward hard toward victory in the second half of the race after recovering endurance with skills at least 3 times.,Increase target speed (0.25),,normal,,,unique,5s
presents_from_x,Presents from X,unique_skill.png,Unique,Increase velocity by deriving a path to victory mid-race after staying well-positioned from the start of the race up until the second half.,Increase target speed (0.35),,normal,,,unique,5s
fairy_tale,Fairy Tale,unique_skill.png,Unique,Increase velocity with the excitement of running when engaged in a challenge while well-positioned in the second half of the race.,Increase target speed (0.35),,normal,,,unique,5s
white_lightning_comin_through,White Lightning Comin' Through!,unique_skill.png,Unique,Bolt down the track like lightning when well-positioned or aiming for the front from midpack on a straight in the second half of the race.,Increase target speed (0.35),,normal,,,unique,5s
barcarole_of_blessings,Barcarole of Blessings,unique_skill.png,Unique,"Increase velocity for a moderate duration when in the front part of the pack with 400m remaining. If at least 7 skills have been activated, greatly increase velocity for a moderate duration instead.",Increase target speed (0.45),,normal,,,unique,4s
114th_time_s_the_charm,114th Time's the Charm,unique_skill.png,Unique,"Give max effort when far from the lead on the final corner, moderately increasing velocity steadily for a duration proportional to distance from the lead.",Increase target speed (0.25),,normal,,,unique,
ambition_to_surpass_the_sakura,Ambition to Surpass the Sakura,unique_skill.png,Unique,Increase velocity with blossoming ambition when well-positioned and close to the runner ahead with 300m or less remaining.,Increase target speed (0.35),,normal,,,unique,5s
a_lifelong_dream_a_moment_s_flight,"A Lifelong Dream, A Moment's Flight",unique_skill.png,Unique,"Seize the moment when close to the runner behind on the final straight, slightly consuming endurance to greatly increase velocity for a moderate duration.",Increase target speed (0.45),,normal,,,unique,4s
operation_cacao,Operation Cacao,unique_skill.png,Unique,Take a slight breather and increase velocity when in the front part of the pack and detecting another runner coming from behind on a corner mid-race.,Increase target speed (0.35),,normal,,,unique,5s
guten_appetit,Guten Appetit ♪,unique_skill.png,Unique,Increase velocity continuously with a patissiere's pride on the final straight after passing another runner 3 times on the final corner or later.,Increase target speed (0.35),,normal,,,unique,6s
shooting_star_of_dioskouroi,Shooting Star of Dioskouroi,unique_skill.png,Unique,"Increase velocity with guidance from the stars when far from the lead on the final straight. If positioned around the very back, greatly increase velocity instead.",Increase target speed (0.35),,normal,,,unique,5s
victory_cheer,Victory Cheer!,unique_skill.png,Unique,"Moderately increase velocity when positioned toward the front on the third corner in the second half of the race. Or, kick forward hard when toward the front on the backstretch late-race.",Increase target speed (0.25),,normal,,,unique,5s
eternal_encompassing_shine,Eternal Encompassing Shine,unique_skill.png,Unique,"If well-positioned at the start of the final straight, her strong willpower to win increases velocity. If positioned near the front, greatly increase velocity instead.",Increase target speed (0.45),,normal,,,unique,5s
lovely_spring_breeze,Lovely Spring Breeze,unique_skill.png,Unique,"From the midpack in the second half of the race, slightly increase velocity steadily for a duration based on remaining endurance.",Increase target speed (0.15),,normal,,,unique,
ravissant,Ravissant,unique_skill.png,Unique,"When passing another racer at the front part of the pack on the final corner or later, perform a dazzling display that greatly increases velocity for a moderate duration.",Increase target speed (0.45),,normal,,,unique,4s
break_it_down,Break It Down!,unique_skill.png,Unique,"If positioned toward the front on a straight late-race, increase velocity with high spirits. If the straight is on the backstretch, also increase acceleration very slightly.",Increase target speed (0.35),,normal,,,unique,5s
peerless_dance_of_flowering_flames,Peerless Dance of Flowering Flames,unique_skill.png,Unique,"If the user passes another runner on the final corner or later, increase velocity with fiery fighting spirit when in the front part of the pack with 300m or less remaining.",Increase target speed (0.35),,normal,,,unique,5s
gogogoal,Go☆Go☆Goal!,unique_skill.png,Unique,"If the user passes another runner on the final corner or later, increase velocity from the midpack onward on the final straight. If the user isn't one of the top favorites, muster resolve to keep steadily increasing velocity.",Increase target speed (0.35),,normal,,,unique,6s
all_charged_it_s_go_time,All Charged! It's Go Time!,unique_skill.png,Unique,"Moderately increase velocity when positioned toward the front with about 300m remaining. If coming out of an uphill, greatly increase velocity instead.",Increase target speed (0.45),,normal,,,unique,5s
